763208833242103808;2016-08-10 03:02:20;Velório do alto rei Wryn #Warcraft! #legion =( https://t.co/1sNUNTVyOu
763208755123105794;2016-08-10 03:02:01;She's ready! #Warcraft #Legion https://t.co/2hRROLBetz
763208633060618241;2016-08-10 03:01:32;#DemonHunter mount!  #Warcraft #Legion #Mardum https://t.co/JFcyS0QbSO
763208551221358592;2016-08-10 03:01:12;The #Legion is here! #Warcraft https://t.co/YSrRiZQKaG
763208223763554304;2016-08-10 02:59:54;For the Alliance - A Tribute: https://t.co/2yaqya1l21 #Warcraft #Legion
763207399121514496;2016-08-10 02:56:38;"""The Legion is here, spreading fire and chaos throughout the land."" (A few words from Melathor: https://t.co/dyXuclOTge) #legion #warcraft"
763206221138685952;2016-08-10 02:51:57;"Solo el pre-parche y de a poco ya vuelve el vicio xD "" Irysvìel "", linda mi #DemonHunter ♥ #Warcraft #WoW #Legion https://t.co/d5IhJuvraG"
763205949364457472;2016-08-10 02:50:52;Llorar como estúpida por la muerte de mi rey #VarianWrynn    #Warcraft #legion
763205864975020032;2016-08-10 02:50:32;Well shoot. I hope this gets fixed soon! :( #warcraft #Legion @warcraft https://t.co/BoW6GZtSVR
763205408152494080;2016-08-10 02:48:43;Pre-paid my CE for #Warcraft #Legion today, even though I'll be at @DragonCon when it drops. Playing as long as I have, waiting is ok.
763204915669762048;2016-08-10 02:46:46;If someone figures out how to disable/eliminate those new NPC chat popups that cover my toolbar could you please tell me? #Warcraft #Legion
763204229574123521;2016-08-10 02:44:02;You will not be forgotten #warcraft #legion #KingVarianWrynn #Vol'jin https://t.co/kSURzHtTJN
763202562992447488;2016-08-10 02:37:25;"Meet Sattivana. She's all kinds of awesome. &lt;3 #warcraft #Legion https://t.co/fn8ZJUSrif"
763202393685291008;2016-08-10 02:36:44;So it begins. #DemonHunter #Legion #Warcraft https://t.co/cQcOKMeavV
763202281613369345;2016-08-10 02:36:18;Bout to destroy a giant flaming tank! lol #wow #warcraft #legion #destroyedAtank https://t.co/8IBVcMTcFs
763202225221099520;2016-08-10 02:36:04;/wave #DEMONHUNTER #Stormwind #Rs #Selfie World of #Warcraft #LOVE 4 #AZEROTH #LEGION https://t.co/ajIzdOO8ET
763202006974623744;2016-08-10 02:35:12;Yeah #DemonHunter! On Live!  #Warcraft #Legion #Illidari https://t.co/FgAp2OyXsy
763201241652625408;2016-08-10 02:32:10;#Blizzard fights chat abuse in World of #Warcraft #Legion #WoW #Gaming #MMO #RPG #Tech https://t.co/U6RlC2xfRD https://t.co/5frgclF3ej
763200829843120128;2016-08-10 02:30:32;Streaming Beta Testing https://t.co/mBdK6nIBOR #Twitch #Youtube #Warcraft #Legion
763200391504855040;2016-08-10 02:28:47;Dioh mio D: #Demonhunter #Legion #Warcraft https://t.co/Ai3NaHtiIr
763200086608375810;2016-08-10 02:27:34;▇ ▇ EU Realms are online! You can now create Demon Hunter if you have the #Legion #expansion. Good luck and enjoy!  ▇ ▇  #Warcraft #Legion
763200065842257920;2016-08-10 02:27:29;tomb of the betrayer #legion #Warcraft https://t.co/vn5B3M1H5h
763199665605050370;2016-08-10 02:25:54;Sylvanus! You broke my heart! 💔 #warcraft #Legion #HeavyIsTheHead
763199429990113280;2016-08-10 02:24:58;And another demon lord is gonna bite the dust!... sand!...whatever! #Legion #Warcraft #Horde https://t.co/PTD6UtBYJE
763199146350284800;2016-08-10 02:23:50;Demon Hunters are now live in EU! #Legion #Warcraft https://t.co/3M13Xy1Qg4
763199131653328896;2016-08-10 02:23:47;Not Bad for a first BG #Legion #ThankyouBlizz  #Warcraft! https://t.co/BomsrHvsQu
763198494068740096;2016-08-10 02:21:15;"I love the #DemonHunter &lt;3 World of #Warcraft #Selfie #WoW #BElf #WoWselfie #Horde #Legion https://t.co/3DqFxqwts4"
763197898414706688;2016-08-10 02:18:53;I just earned the [Level 100] Achievement! #Warcraft #Legion #DemonHunter https://t.co/7L8PusNkcI
763197510617821184;2016-08-10 02:17:20;EL HYPE ME CONSUME D: #Legion #Warcraft #DemonHunter https://t.co/6Vo8xUDgJ4
763197158824652800;2016-08-10 02:15:56;in the lair of the Brood Queen #legion #Warcraft https://t.co/kRgNs4vDYl
763197119868043264;2016-08-10 02:15:47;Epic Scene!!! #Warcraft #Legion  https://t.co/36Nxa6sEHt
763196103059701764;2016-08-10 02:11:45;I dunno, someone about this doesn't seem right #Crossroads #Warcraft #Horde #Legion https://t.co/8NUWgVFxWX
763196013205159940;2016-08-10 02:11:23;▇ Countdown 20 #Warcraft #Legion ▇ #PokemonGO #TeamValor ▇  ▇ ▇ INVASIONS AND ILLIDARI STARTS TODAY! ▇ ▇ https://t.co/oZ8MzcxVlC
763194389019582465;2016-08-10 02:04:56;It has begun!  #Warcraft  #Legion https://t.co/jzH4GJGaxM
763193015779205120;2016-08-10 01:59:29;Jesus. Vault of Wardens = worst stair design ever #warcraft #legion
763192337702920193;2016-08-10 01:56:47;Wow... That Broken Isles intro... Wow. #Warcraft #Legion #horde #awesome
763192284980666368;2016-08-10 01:56:34;Confirmed: George R.R. Martin is now working for @Blizzard_Ent #Warcraft  #Legion
763191941156724736;2016-08-10 01:55:12;Demon hunter ready to battle the burning legion! #legion #warcraft https://t.co/Kas5cATZrM
763191689477357568;2016-08-10 01:54:12;"The couple that Demon Hunters together, stays together &lt;3 lol #Warcraft #GamersUnite #Legion https://t.co/DHQQoR7C8v"
763191110403514377;2016-08-10 01:51:54;Videos to Make #wow #d3 #youtuber #vlog #diablo #warcraft #youtube #vlogger #legion #demonhunter https://t.co/YlhMP4Znab
763190552871383040;2016-08-10 01:49:41;dreadlord meetup 2k16 #warcraft #legion https://t.co/NgAASjaJ2a
763190508164382721;2016-08-10 01:49:31;Ant and i got our demon hunters all good to go against the legion #wowselfie #legion #demonhunter #Warcraft https://t.co/a7CjNc59RI
763190123290890241;2016-08-10 01:47:59;Fica com os espíritos cara... #warcraft #warchief #voljin #legion #wow #forthehorde https://t.co/Qx90LXf9gy
763189787691999232;2016-08-10 01:46:39;In case you missed it:  Sharing Saturday: World of #Warcraft #Legion #Fanart #art #bloodelves #demonhunters... https://t.co/zrtZe4KFAt
763188805306167297;2016-08-10 01:42:45;The feels man. These cut scenes are amazing. YOU ARE PREPARED! #deeznerdz #warcraft #legion
763188723949240320;2016-08-10 01:42:25;ERMAHGERD! DERRRRMERRN HERRRNTERRR!! #legion #warcraft https://t.co/b0h4TUuK5F
763187048937295873;2016-08-10 01:35:46;Olha, com essas cinematics de Legion, a Blizzard não merece só palmas, merece o Tocantins inteiro! 👏 #Warcraft #Legion
763186955958030337;2016-08-10 01:35:24;Broken isles quest line made my eyes sweat a little. So much feels. #Legion #Warcraft
763186531934867456;2016-08-10 01:33:43;I WILL NEVER FORGIVE YOU, SYLVANAS #Warcraft #worldofwarcraft #Legion
763185638732500992;2016-08-10 01:30:10;That person annoying the shit out of you by spamming double jump? Yeah, that's me. #sorrynotsorry #legion #warcraft https://t.co/wUf5XJGj2K
763184772789207040;2016-08-10 01:26:43;The Emerald Nightmare Legion Raiding https://t.co/xD3wLCW56n @PrometheanGuild #wow #warcraft #rogue #raiding #legion https://t.co/YeK7wcfyhq
763184503590416384;2016-08-10 01:25:39;Ok I'm crying.  #Warcraft #legion
763184432132059136;2016-08-10 01:25:22;"Hasta luego Varian Wrynn. ;( #Warcraft #Wow #Legion"
763182558423060480;2016-08-10 01:17:55;I just earned the [Level 100] Achievement! #Warcraft  And so it begins :) :)   #demonhunter #dh #legion #prepared https://t.co/cJmvsR6VU6
763182193078394880;2016-08-10 01:16:28;Uhh hey #Warcraft are you feeling alright? #Legion #JurassicParkOnline https://t.co/v6r8OzQKFD
763182122580316160;2016-08-10 01:16:11;Want a chance at winning a Blizzcon Virtual Ticket?!? Click Here: https://t.co/f3t5Et6yW3  #Warcraft #Legion #demonhunter #overwatch #WoW
763181098205585408;2016-08-10 01:12:07;Holy fuck these #Legion cinematics. For the Horde! #Warcraft #worldofwarcraft
763180441843146752;2016-08-10 01:09:31;That intro scenario was Bad Ass. Simple as that. Looking forward to seeing horde side soon. #Warcraft #Legion
763180250461147136;2016-08-10 01:08:45;Demon Hunters everywhere #Lol #Legion #Warcraft https://t.co/XzljHi3jWE
763179909447553025;2016-08-10 01:07:24;Nothing brings out the Demon Hunters like a good demon invasion. They are everywhere! #Legion #Warcraft
763179736575123456;2016-08-10 01:06:43;All these demon hunters. It's a little creepy. #deeznerdz #warcraft #legion https://t.co/O3BLxBowah
763179625803616257;2016-08-10 01:06:16;MY HEART IS TWICE BROKEN I HATE YOU, GUL'DAN 😢😢😢  #Legion #wow #warcraft
763179162337091585;2016-08-10 01:04:26;#ILLIDARI #LEGION #DEMONHUNTER #HORDE World of #Warcraft! https://t.co/UJamon3NV9
763178992660799488;2016-08-10 01:03:45;#Warcraft #Legion Demon Hunters are running wild https://t.co/s7UEU1mquR
763178964273729536;2016-08-10 01:03:38;Never forget Vol Jin #legion #warcraft https://t.co/cUt2a5yRPB
763178887022993408;2016-08-10 01:03:20;So, how many Demon Hunters in WoW are gonna have the Illidan horns?! I am guessing ALL OF THEM. #Legion #Warcraft #NotPrepared
763178722279038976;2016-08-10 01:02:41;@Warcraft @Blizzard_Ent #Legion #Warcraft I just want to pvp at 110 on my characters avoiding the most #pve #Content #possible
763178259278213120;2016-08-10 01:00:50;@Warcraft @Blizzard_Ent #Legion #Warcraft Do i have to complete that legion invasion quest on each character to progess in Legion? #PVP
763177740237496321;2016-08-10 00:58:47;Por la Alianza!  #Warcraft! #Legion https://t.co/qb8YqyW4l5
763177352071417856;2016-08-10 00:57:14;#LEGION FEL WAR SHIP World of #Warcraft #Rs #Selfie https://t.co/HcU9pKkg1R
763176997279465472;2016-08-10 00:55:49;The Guide to World Quests in World of #Warcraft #Legion https://t.co/c374AQa8E1 #WoW
763176987074498560;2016-08-10 00:55:47;#Olympics huh? Didn't notice. I'm too busy hunting demons. #Warcraft #Legion #DemonHunter #gamergirl @Warcraft https://t.co/BJOsyGrmpQ
763176793717219328;2016-08-10 00:55:01;#Legion makes it more like World of sci-fi craft? #Warcraft https://t.co/rfymvqRVJ3
763176220045348865;2016-08-10 00:52:44;fel ships! #legion #Warcraft https://t.co/urDatyajPN
763176215465385984;2016-08-10 00:52:43;¿Sabéis que día es hoy? Es el día en el comienzan las invasiones demoníacas.¿Estáis preparados? ¡Debéis estarlo! #Legion #Warcraft #WoW
763176091213234176;2016-08-10 00:52:13;"Last 10 minutes with Varian &lt;/3 #Warcraft #Legion https://t.co/CGL4KUz0a8"
763175877953851392;2016-08-10 00:51:23;Oh sweet queue, how did I miss thee ... NOT!!! #Warcraft #Legion https://t.co/bwMAmlGtQt
763175326470004737;2016-08-10 00:49:11;HAIL TO THE QUEEN! #warcraft #Legion #SylvanasWindrunner
763174880573403136;2016-08-10 00:47:25;#DemonHunter woohoo!!! #wow #Warcraft #Legion https://t.co/mft65ifK24
763173436784975874;2016-08-10 00:41:41;So many feels leveling #DemonHunter #YouWereNotPrepared #Legion #Warcraft #ForTheHorde ♥
763173029790834689;2016-08-10 00:40:04;"Found a new item while data mining: ""Arrow of Great Energy"". Not sure if this is crafted or a drop or both. :D #warcraft #legion"
763172950505877504;2016-08-10 00:39:45;I'm embarrassed to say after I got to stormwind dock I still wasn't 100 on my DH. I'm a few kills from 100 it looks like. #Legion #Warcraft
763172565917569024;2016-08-10 00:38:13;Logged in to find this Horde Pally in Kharanos. #warcraft #alliance #legion https://t.co/IzxRTJ3fRX
763172380608913411;2016-08-10 00:37:29;It looks like kodos got a high-res update too. #Warcraft #Legion https://t.co/rE0phxUbM3
763172172978278400;2016-08-10 00:36:39;Check out my majestic beast #warcraft #legion https://t.co/SGcMMNv1WN
763171561453023233;2016-08-10 00:34:13;I don’t have a max level #Alliance character… Is there a cinematic back in Stormwind? Can’t find anything on YouTube. #Warcraft #Legion
763171032131735554;2016-08-10 00:32:07;Tirion! #legion #Warcraft https://t.co/hxgCf4Skcu
763170240087949312;2016-08-10 00:28:58;I really enjoyed playing #DemonHunter as Tank, What does everyone think? #Legion #worldofwarcraft  #Warcraft
763169697520955392;2016-08-10 00:26:49;THIS is happening right meow #warcraft #legion https://t.co/0OxJabBw4q
763169536359084033;2016-08-10 00:26:11;Not all survived, but we did... #Warcraft #Legion https://t.co/g34dr5B7v2
763169533142106113;2016-08-10 00:26:10;Maximillian of Northshire just showed up to help out against the demon invasions. #Legion is officially epic. #Warcraft #WoW #Chivalry
763169292825178112;2016-08-10 00:25:13;I'm already sick of seeing Demon Hunters... #Warcraft #Legion
763168787118030848;2016-08-10 00:23:12;This Hordie totally did not cry like a baby for Varian.  #sobbed #Warcraft #Legion #ForTheAlliance #justthisonce
763168664245837824;2016-08-10 00:22:43;Better than Kaja cola: Buy a shirt. Cut into strips. Sell strips to DHs for eyes. Repeat.  #warcraft #legion
763168108483710976;2016-08-10 00:20:30;on the boat! #legion #Warcraft https://t.co/IEwWauv95h
763166614241935360;2016-08-10 00:14:34;Woah that Infernal is huge! #Warcraft #Legion https://t.co/LRd08tWAvB
763166328169660417;2016-08-10 00:13:26;Rolling a Demon Hunter? Make sure you watch my Starter Guide for Demon Hunter!  https://t.co/uhvCGTjcI6 #Warcraft #Legion #Guide
763166056294645760;2016-08-10 00:12:21;So I just did the Broken Shore scenario. :'( #sad #why #goddammitblizzard #warcraft #legion https://t.co/kmYTijweSP
763165728937807872;2016-08-10 00:11:03;Warcraft, you are so beautiful. #Azeroth #wow #warcraft #astral #legion https://t.co/McA1bf7dCO
763165632737136640;2016-08-10 00:10:40;#Legion Sure is bringing everyone together! Look at all these people sharing a flightpath #Warcraft #MMORPG https://t.co/18CDpiJcuY
763165509760196608;2016-08-10 00:10:11;looks like someone gave into the dark whispers... @lightofthenaaru #warcraft #legion https://t.co/iCOPYfD8hO
763165376570134528;2016-08-10 00:09:39;Check out my screenshot from World of #Warcraft! Our evil dreadlord coven! #legion #invade #giveintodarkness https://t.co/ZABUPyKmSE
763165238287925248;2016-08-10 00:09:06;Roar! IMA MOTHERFKN T-REX!!!! #Warcraft #Legion https://t.co/c2ItO1B803
763164526946705409;2016-08-10 00:06:16;#Blizzard ballgags chat abusers in World of #Warcraft #Legion #WoW #Gaming #MMO #RPG #Tech https://t.co/e8v0w4sSpQ https://t.co/wCYvMFzDu7
763163940142538753;2016-08-10 00:03:56;Doing Broken Shore!!! #Legion #Warcraft https://t.co/Mdv3T2fSAG
763163288242950145;2016-08-10 00:01:21;When your computer is too toaster to help DX #Warcraft #Legion https://t.co/Wv7e9CTgKt
763162776684539905;2016-08-09 23:59:19;The #Legion has arrived and Warsong Battalion is here to meet them! @Himanshuwsb #Warcraft https://t.co/Tj1sZkvffZ
763162746208804865;2016-08-09 23:59:12;Just making sacrifices so that we can open this gateway. #helpingtheworld #warcraft #horde #dh #legion https://t.co/QdnwZruxN3
763161625037774848;2016-08-09 23:54:44;Fought with the best. #Legion #Warcraft https://t.co/dg9rpL5lwY
763161229154217984;2016-08-09 23:53:10;Hoy se nos fueron dos grandes héroes #Warcraft #Legion  los vengaremos #ForAzeroth
763160703406661637;2016-08-09 23:51:05;I have been told I WIN for name/title for #DemonHunters in #Legion #Warcraft Let it be known I R Origional! :) https://t.co/BWyyTh8rPD
763160469716729856;2016-08-09 23:50:09;Becoming a dreadlord in pre-#Legion patch for #Warcraft... 👌 👌 👌 💯
763160095354134528;2016-08-09 23:48:40;my DemonHunter Bexxeb!!!!  #WARCRAFT #LEGION https://t.co/tanxDoH7BK
763159945332137985;2016-08-09 23:48:04;Another shot of the transmog. #DemonHunter #Legion #Warcraft https://t.co/tJW3hJCtbD
763159202357325824;2016-08-09 23:45:07;A Fel Reaver stepped on me.   #Warcraft #Legion
763158834558799872;2016-08-09 23:43:39;SPOILERS #legion #warcraft #wow https://t.co/KRLc9tm1uu
763158596666351616;2016-08-09 23:42:42;For some reason during the #Legion invasion, we all turned into dinos.  Why not?  #Warcraft! https://t.co/RNEd2PnUT3
763157686435377152;2016-08-09 23:39:05;*Does Ally #Legion scenario* What?? No way. *Does Horde scenario* See! I knew there had to be a reason they did!  *cries for days* #Warcraft
763157631989153793;2016-08-09 23:38:52;Cool new friend I've made... #warcraft #legion #demonhunter https://t.co/9aN47OYIuZ
763157489877671937;2016-08-09 23:38:19;Listo para luchar contra la Legión. #Warcraft #Legion #Diohktransfimasguapa https://t.co/ZRqq8fnmHF
763156681605849089;2016-08-09 23:35:06;Come watch me my level my demon hunter with the masses! https://t.co/b7KclBfQqg #deeznerdz #demonhunter #warcraft #Legion
763155750797516800;2016-08-09 23:31:24;Let the final destruction of the Alliance begin!! #WARCRAFT #Legion
763155182591021056;2016-08-09 23:29:08;@Riselvato @DustinCrawford8 Are you Prepared to sacrifice everything for this cup? #Legion #Warcraft
763155067952328708;2016-08-09 23:28:41;invasions with this nerd @lightofthenaaru #warcraft #legion https://t.co/9S7nS1tZnE
763155064932356096;2016-08-09 23:28:40;#Warcraft #Legion Demon Hunter patch goes live right at the start of my 'weekend'. I know what I'll be up to then...
763154477243179008;2016-08-09 23:26:20;Whelp. Looks like the #Legion is here! Can't tell if #Warcraft is giving me a #StarCraft or #StarWars vibe here! https://t.co/cI1VGB7j6q
763154137806675969;2016-08-09 23:24:59;And....she lives!!!! #DemonHunter #Warcraft #Legion #Gwendari https://t.co/dYTLZNcpGu
763153734113169408;2016-08-09 23:23:23;Live now! Demon Hunter Hype! #Legion #demonhunter #warcraft https://t.co/QTCbwXrZvl @girlstreamers @DNR_CREW @ShoutGamers
763153596032647172;2016-08-09 23:22:50;Draenor isn't prepared #warcraft #legion #demonhunter https://t.co/iI366qzYY1
763153306663333888;2016-08-09 23:21:41;Retweeted OCODEX (@lordmons):  CODEX LIVE - Vamos Jogar com os Demon Hunter Juntos! 20:30! #warcraft #legion... https://t.co/Tp8vLpwxp5
763152942065065984;2016-08-09 23:20:14;CODEX LIVE - Vamos Jogar com os Demon Hunter Juntos! 20:30! #warcraft #legion #codex https://t.co/gLTjVh8Cz9 https://t.co/JIcSrci8cI
763152511184302081;2016-08-09 23:18:32;"""Não falhem ou o mundo queimará!"" #Legion #DemonHunter #minhapersonagem #Warcraft! https://t.co/M4BvZgXlQ3"
763152497024393216;2016-08-09 23:18:28;Demon Huntard - Humble Beginnings pt 2 https://t.co/O8HtG3a4ib via @Twitch #Warcraft #Legion #DemonHunter
763152298507956224;2016-08-09 23:17:41;Whoa! I'm tanking a TON of #demons! time for a #selfie Great opening quest for #legion #Warcraft https://t.co/afHZ9qmPm7
763152159567380480;2016-08-09 23:17:08;Speakin' of which, it must be KILLIN' da #Alliance ta have ta DEFEND da Crossroads fer once. #Warcraft #Legion #ForDaHorde
763151150342369283;2016-08-09 23:13:07;Oh the dreaded queue time! #Warcraft #Legion #PrePatch #DemonHunter #GamerGirl https://t.co/yNcsbgtBMt
763150994326818816;2016-08-09 23:12:30;Live now with some #Warcraft #Legion #DemonHunter !! https://t.co/HvZ02mDtJn
763150843763752960;2016-08-09 23:11:54;"""In Mardum! It's... dark. And fel-y."" #Warcraft #Legion https://t.co/0efAfW0gHn"
763150822570012672;2016-08-09 23:11:49;#Legion #Invasion #Warcraft https://t.co/Yam6jMETa8
763149834962567169;2016-08-09 23:07:53;We all were sad about someone dying in the scenario. #Legion #Warcraft https://t.co/zFQrQm7I14
763149263094226944;2016-08-09 23:05:37;on our way to invasion #legion Check out my screenshot from World of #Warcraft! https://t.co/KEDz7RXAvY
763148810524647424;2016-08-09 23:03:49;Kynthe has been reborn as KYNNETIK, the DEMON HUNTER. #warcraft #demonhunter #wow #fel #legion https://t.co/8j7sOgKbCy
763148532391907328;2016-08-09 23:02:43;Friendly #DemonHunter who was deleting their character gave me 894g for free in #Warcraft! #Legion #Gold https://t.co/6TshsDGxUH
763148210571472896;2016-08-09 23:01:26;1 more hour then #GameOn! #GamerChick #GamerGirl #Warcraft #Legion. ❤️ my kids but, get to bed! Lol https://t.co/Wpe5ZjIWVx
763147952013606912;2016-08-09 23:00:25;In Dun Morogh just cleaned up some #Legion! #Warcraft #WorldofWarcraft #WoW #Proper Villains https://t.co/Osqk1taLH5
763147191665864704;2016-08-09 22:57:23;I WILL HELP YOU AVENGE HIM. #WARCRAFT #LEGION #FORDAHORDE
763146933225402368;2016-08-09 22:56:22;DEM CINEMATICS THO'. #WARCRAFT #LEGION
763146482736259072;2016-08-09 22:54:34;#DemonHunter HYPE. Gonna be rolling my DH tonight and taking on #Legion invasions! #wow #Warcraft
763146050731323392;2016-08-09 22:52:51;That Demon Hunter quest line was EPIC! #Legion #Warcraft
763145692521062401;2016-08-09 22:51:26;Loving the Demon Hunters! #Warcraft! #WoW #Demonhunter #legion https://t.co/P8ySANrGMv
763144989534814208;2016-08-09 22:48:38;¡For the alliance! World of #Warcraft! #legion https://t.co/mR823BL7RZ
763144938754338817;2016-08-09 22:48:26;A descansar un rato ¡que en unas horas llega la invasión!#Warcraft #Legion @Warcraft_ES
763144005563641856;2016-08-09 22:44:44;¡For the alliance! World of #Warcraft! #legion https://t.co/y7bbyZuEId
763143787996712961;2016-08-09 22:43:52;Started off as a photo study and then the Demon Hunter hype came in. :D Can't wait! #Warcraft #Legion https://t.co/jOu6TcPocn
763143377747582976;2016-08-09 22:42:14;"@RakaelTowers That #Warcraft #Legion audio drama ""The Tomb of Sargeras"" was exellent! Just what I needed for my long drive."
763143101280051200;2016-08-09 22:41:08;#pew pew pew! Active sub or not, I can do my part!?! =P #WoW #Legion #iamnotprepared #lesigh #Warcraft! https://t.co/0YhVHTWGWz
763143090869723137;2016-08-09 22:41:06;so neat! #warcraft #legion https://t.co/ofScxRrJ87
763142295764041729;2016-08-09 22:37:56;I crashed and logged back in and found myself in the Demon Hunter starting area! #Warcraft @BlizzardCS #Legion https://t.co/zRUSQIYWEs
763141494421262336;2016-08-09 22:34:45;#Selfie w/ Darkmagus Falo'reth Kharanos #DunMorogh #Rs #Selfie World of #Warcraft #LEGION IS HERE https://t.co/pN4663NvPa
763141427630972928;2016-08-09 22:34:29;#Warcraft #Legion I am now PREPARED https://t.co/TngPJrPxVf
763141086403497984;2016-08-09 22:33:08;Loved the cinematics thank you @Blizzard_Ent #Warcraft #Legion
763140990614011905;2016-08-09 22:32:45;"Here's my NE #Demonhunter, I might had some influence lately from another nelfie in my life. &gt;.&gt; #warcraft #legion https://t.co/xYnCm4FiZV"
763140967176269824;2016-08-09 22:32:39;#Legion Invasion! World of #Warcraft! https://t.co/jrYJ4NWeIH
763139808948551681;2016-08-09 22:28:03;Youve done it again blizz Ill never forgive you for your...cull 😡 #warcraft #legion https://t.co/z6iLr9W8OM
763139712106332160;2016-08-09 22:27:40;#Warcraft #VoljinDidNothingWrong #Legion
763139027633438720;2016-08-09 22:24:57;@Blizzard_Ent Absolutely 💜 demon hunters and #Legion so far thank you. #ForTheHorde #Warcraft #NeverToOldToGame. 😍
763138737983414276;2016-08-09 22:23:48;Heroes of the Alliance! We march to war! #ForTheAlliance #BrokenShore #Warcraft #Legion
763138533561208832;2016-08-09 22:22:59;Glassey Eyes from the cut scenes #warcraft #Legion
763136925549101056;2016-08-09 22:16:36;Holy shit!!! All these cinematics are great! #HYPE #Legion #Warcraft
763136182939029504;2016-08-09 22:13:39;#SpoilerAlert The #Legion... has returned... #DunDunDUNNN #Warcraft https://t.co/qqmof1xVrN
763135652644974593;2016-08-09 22:11:32;Can demon hunters tank on live #Legion #Warcraft
763134837096058884;2016-08-09 22:08:18;Somos LEGION!!! #Warcraft #Legion https://t.co/jUE9IbiAHB
763134640085278720;2016-08-09 22:07:31;Glad that I waited to see this stuff until it went live. What a blast the Demon Hunter experience is! Totally floored. #Warcraft #Legion
763134276921622528;2016-08-09 22:06:04;Moar #Warcraft #DemonHunter #Legion fun... https://t.co/Bj7lZuhHT0
763133553781542912;2016-08-09 22:03:12;I have literally never been happier than I am at this moment. #Warcraft #Legion https://t.co/ht8iFGbcYI
763132778800185344;2016-08-09 22:00:07;Are you prepared? I am PREPARED!!  #LiebeJager #Legion #Warcraft @Warcraft https://t.co/wE6xuIS1Ec
763132668703899648;2016-08-09 21:59:41;So many #Warcraft invasions! So little time... #Legion https://t.co/d7Zg5NF1dH
763132214670266368;2016-08-09 21:57:52;Just got my demon hunter to [Level 100]! #Warcraft #WoW #DH #DemonHunter #WorldofWarcraft #Legion https://t.co/JckKV5LTSR
763132130650103808;2016-08-09 21:57:32;This is my demon hunter. Her name is LilithSixx.  #warcraft #demonhunter #legion https://t.co/1FI4DI9OwD
763131464712089601;2016-08-09 21:54:54;[Aman]👊 Hype Pré-expansão Eventos #Horda   https://t.co/Amrw7FWkog       #WoWLegion #ToNaTwitch #Warcraft #Legion https://t.co/aCkUptdUS0
763131342439809025;2016-08-09 21:54:24;Did you notice this? The thing on left hand?  #Warcraft #Legion #Garrison https://t.co/gQd8FHDSQ3
763130820504629248;2016-08-09 21:52:20;@thegoldqueen Someone cut a fiber optic line and half the town's Internet is down. No Demon Hunter today *cry* #Legion #Warcraft
763129930603528197;2016-08-09 21:48:48;Better than any DH #Warcraft #Legion RWAR!! https://t.co/4mPhuNiWGO
763129775925768192;2016-08-09 21:48:11;#Legion pre-day! World of #Warcraft! https://t.co/peqAFQ6s4p
763129381334028288;2016-08-09 21:46:37;Bout to make me a Night Elf Demon Hunter. See y'all there!! #Warcraft. #Legion.
763128835088842752;2016-08-09 21:44:27;Check out my screenshot from World of #Warcraft! #legion https://t.co/BOnCucBYRa
763128724237742081;2016-08-09 21:44:00;Nothing quite like killing demons in the desert listening to the Mad Max soundtrack #Legion #Warcraft
763127730070315008;2016-08-09 21:40:03;Affliction Warlock artifacts will now be guns with exclusively arcane traits in keeping with lore. #warcraft #legion
763127299357208577;2016-08-09 21:38:21;Damn it feels good to be a Demon Hunter ( ͡º ͜ʖ ͡º) #Legion #Warcraft https://t.co/Cnsxx4ibtH
763127198832205825;2016-08-09 21:37:57;Live with Demon Hunter gameplay! #Warcraft #wow #legion #gaming  https://t.co/6X7vHhMvSf
763126372202078208;2016-08-09 21:34:39;CODEX LIVE - Vamos Jogar com os Demon Hunter Juntos! 20:30! #warcraft #legion #codex https://t.co/gLTjVhqdXJ https://t.co/Z9RMuCI0my
763126244053430272;2016-08-09 21:34:09;Our Legion Overlords have arrived! #Legion #Warcraft #IObey https://t.co/iik4eMMBCu
