765520232911896576;2016-08-16 12:07:00;Going Pet Battler in #Warcraft #Legion ?  Let me point you to https://t.co/HjjpjonkBL , from @XuFusPetguide !  Instant shopping list :D
765520179195420672;2016-08-16 12:06:48;Me, trying to pick a main for #Legion #Warcraft  https://t.co/CJSOMqIyTf
765519425911029762;2016-08-16 12:03:48;Less than 3 @Fleewer #Warcraft #Legion #TarrenMill https://t.co/yyAoyEkUcH
765518310368739329;2016-08-16 11:59:22;After many years, a kid dream comes reality. I can finally watch movies on my #GbaSP ! #Legion #Warcraft #Cinematic https://t.co/WW7gJiZXVk
765516094979338240;2016-08-16 11:50:34;How to Power Level and Gear Up Fast During the #Legion Invasion #WoW #Warcraft https://t.co/I8QCAIThOP
765515238317916161;2016-08-16 11:47:10;Questing in #warcraft is so relaxing when u are not in hurry! #Legion
765513954915332096;2016-08-16 11:42:04;Worlds best X-Mog... #warcraft #legion https://t.co/GHDoDaZEjo
765512560355450880;2016-08-16 11:36:31;#Warcraft Con la llegada de la #Legion a @Warcraft_ES regresan a su casa miles de jugadores de #PokemonGo https://t.co/jX3ohiSIWT
765511718328012800;2016-08-16 11:33:10;Check out my screenshot from World of #Warcraft! The FPS may suck, but the teamwork is awesome #Legion https://t.co/cBzN63cffz
765509715933691904;2016-08-16 11:25:13;Only 2 weeks till Legion hits.  are you hyped?  #warcraft #legion
765504788209496064;2016-08-16 11:05:38;#Blizzard ballgags chat abusers in World of #Warcraft #Legion #WoW #Gaming #MMO #RPG #Tech https://t.co/e8v0w4sSpQ https://t.co/WmLemmik2Z
765503778095325184;2016-08-16 11:01:37;#Blizzard fights chat abuse in World of #Warcraft #Legion #WoW #Gaming #MMO #RPG #Tech https://t.co/U6RlC2xfRD https://t.co/6UdzdUimIA
765501261148000257;2016-08-16 10:51:37;I wish i could remotely access my game from the office, still have some alts needing the xp from the invasions. #legion #warcraft
765496130218188800;2016-08-16 10:31:14;#Warcraft Seguimos luchando contra la #Legion en el Evento Pre-Expansión ! y ojo, están en todas partes! https://t.co/11lfVRfzSf
765495320998445058;2016-08-16 10:28:01;SOMEONE PLEASE SEND HELP...THIS DRUID IS CLEARLY INFECTED WITH LEGION STUFF... #Legion #worldofwarcraft #warcraft https://t.co/pssOxfCv7m
765494597514629120;2016-08-16 10:25:08;Enfin, cette réputation est terminée. Du coup une monture de plus. #Warcraft, #Legion https://t.co/pjM1fbv7QU
765493533767770112;2016-08-16 10:20:55;Nous recrutons pour Légion ! https://t.co/MyGRWOuJ7T https://t.co/ouIhfkQgc2 #Legion #wow #warcraft #recrutement https://t.co/hMoJZIIaBG
765488631477858308;2016-08-16 10:01:26;Смотрите на мой скриншот из World of #Warcraft! #Legion #wowlegion  Бэтмен из лав )* https://t.co/fBimhUuDOl
765485292027535360;2016-08-16 09:48:10;I'm just gonna sketch Demon Hunters for the rest of my life.   #Warcraft #Legion https://t.co/3tBmVztKh7
765483258989731840;2016-08-16 09:40:05;Finally, casuals get some love! Haunted Ladies' Ointment has a unique look and is exclusive to LFR. #warcraft #legion
765474021001596929;2016-08-16 09:03:23;"World War AV: Owlcapwn &amp; Bud - Just doing what Boomkins do. @Warcraft #Warcraft #Legion #worldofwarcraft https://t.co/Lf6HUMHQTb"
765473446134419456;2016-08-16 09:01:06;Saving the World of #Warcraft from the #legion! https://t.co/0IQF8DPLY3
765472712928075776;2016-08-16 08:58:11;2 CUTE 4 WARDS! #NEBE #Warcraft #Legion @Warcraft https://t.co/HY10khq6XT
765471802885705728;2016-08-16 08:54:34;Um,..Nazgrim and Garrosh back from dead to witness Voljins death? #warcraft #legion https://t.co/FJoGd3EMxK
765471452623540224;2016-08-16 08:53:10;Shaman Far Sight for some good screenshots during Broken Shore even #legion #warcraft https://t.co/zpUFQYhmqX
765471346914578432;2016-08-16 08:52:45;2 weeks!!! #legion #warcraft https://t.co/yGaIz1MFyo
765470969318166528;2016-08-16 08:51:15;Scary skies in Hillsbrad Foothills #warcraft #legion https://t.co/8Jx27fXNaZ
765461427545047040;2016-08-16 08:13:20;So, I bought #Warcraft #Legion... I wasn't prepared for Broken Shore! Video: https://t.co/Ax74KbtfRd #BrokenIsles https://t.co/Bi8XnbwM9r
765460098705657856;2016-08-16 08:08:03;I just got a pair of 720 ilevel boots from the #Legion Invasions D: Warforged Hotfix ftw!! #Warcraft https://t.co/xiBxIXFxIB
765457297548124160;2016-08-16 07:56:55;Time for a full on invasions grind on all my chars. Better watch some Netflix before I fall asleep yo #Warcraft #Legion
765454319135105024;2016-08-16 07:45:05;I laugh at people bitching about AFK players soaking XP or flying above during invasions. Its part of it. #WoW #Warcraft #Legion
765452251016077312;2016-08-16 07:36:52;My Alliance Demon Hunter, Mezoti.  #Warcraft #Legion #Altoholism https://t.co/4e087gQ6V5
765450894737547264;2016-08-16 07:31:29;My Horde Demon Hunter, Tuvok. Dunno when I'll pull him from the bench tho.  #Warcraft #Legion #Altoholism https://t.co/by5aYDSKMo
765450326505689088;2016-08-16 07:29:13;UMMM...... HI?!?!?  #Warcraft #Legion https://t.co/VyuHSmuf3r
765448728077623296;2016-08-16 07:22:52;Thea got me a new hat c: #warcraft #legion #worldofwarcraft #moonguard https://t.co/XXmyPoTmA2
765445710867156992;2016-08-16 07:10:53;Look what's at my place :D #Warcraft #Legion https://t.co/7JBvyx4fCD
765441870323408900;2016-08-16 06:55:37;#Blizzard ballgags chat abusers in World of #Warcraft #Legion #WoW #Gaming #MMO #RPG #Tech https://t.co/e8v0w4sSpQ https://t.co/aXuMUJUBaQ
765439478697566208;2016-08-16 06:46:07;Just 14 more days until #Legion launches!! #Hype #BrokenShore #Warcraft https://t.co/EA4Mn2GVp4
765437963148914688;2016-08-16 06:40:06;New quest item scraped from the latest build. Sigil of Frost is a complete mystery so far.  #warcraft #legion
765435616062570496;2016-08-16 06:30:46;It's getting really frustrating with all the AFK players soaking stage exp for levels during the #Legion Invasions. #WoW #Warcraft
765434734872698882;2016-08-16 06:27:16;Interesting! looks like #legion scaling is implemented for invasions! #warcraft https://t.co/G0sOgKKmfW
765431722741727232;2016-08-16 06:15:18;New pre-expansion quests tomorrow! Hype! #warcraft #Legion #worldofwarcraft https://t.co/Ya2zmkhuzP
765423122103148544;2016-08-16 05:41:07;Demon Hunter Synopsis: World of Warcraft https://t.co/cMxtxsUd0R #Warcraft #DemonHunter #Legion
765421592725843968;2016-08-16 05:35:03;Invasion Gear now have a chance to be Warforged! #Legion #WoW #Warcraft https://t.co/TI90mKdaze
765414377738625024;2016-08-16 05:06:23;LOL I get it: Legen-Dairy (moo) -- #Warcraft #Legion https://t.co/zL2hAwluRt
765414359346638848;2016-08-16 05:06:18;A big shout out, and thank you, to all of the healers who show up to invasions. Thanks for keeping me alive!  👍 #Warcraft #Legion
765413961751728128;2016-08-16 05:04:43;"Im there, you should be there too;) #warcraft #legion #healers https://t.co/4CN9Uk0T3f"
765412452448112640;2016-08-16 04:58:43;Jamming on the #warcraft making sales on the auction house, stacking gold before #Legion working toward my spider mount. Still a ways off.
765408293997060096;2016-08-16 04:42:12;Yup, this is Hell. Even the game doesn't recognize that I'm alive... #Warcraft #Legion https://t.co/039boli6Jg
765407829524029440;2016-08-16 04:40:21;It says I'm dead, but I'm not... Is this Hell?.... #Warcraft #Legion https://t.co/8SkSg9w7b3
765398913750708224;2016-08-16 04:04:56;@Warcraft #Legion #warcraft Don't ask whats going on here, just bask in it's glory. https://t.co/UDfEnIXNX6
765398796004044800;2016-08-16 04:04:28;Um, did I just hear #Kansas on a #WoW trailer?! #Warcraft #Legion
765398285360050176;2016-08-16 04:02:26;Even the Little ones will fight #Warcraft! #Legion https://t.co/criTB1zNL1
765397324352872448;2016-08-16 03:58:37;#Blizzard ballgags chat abusers in World of #Warcraft #Legion #WoW #Gaming #MMO #RPG #Tech https://t.co/e8v0w4sSpQ https://t.co/UVEy0Vq5J8
765396607412109312;2016-08-16 03:55:46;this one is for you HOLLA #PEEPS Jack-o'-Lanterned! #Rs #Selfie World of #Warcraft #BlazingWings! #LEGION INVASION https://t.co/khUpVLIqze
765396113729945600;2016-08-16 03:53:48;Ok, but can Apotheosis NOT come out of my head? #warcraft #Legion https://t.co/bXSDK0Lgdg
765392661398360064;2016-08-16 03:40:05;New aquatic pet scraped from the latest build. Draining Camel comes in P/P or S/S breeds. Woot!  #warcraft #legion
765390816613310464;2016-08-16 03:32:45;Legion got me like... #wow #warcraft #legion #Rogue https://t.co/Ym5uzKgDl4
765388350274539520;2016-08-16 03:22:57;Streaming some #Warcraft getting ready for #Legion https://t.co/LRp9fTHxNy #SupportSmallStreamers
765387469139214336;2016-08-16 03:19:27;Demons in Dun Morogh? Hope Mom and Dad are okay... #distressingdamsel #legion #warcraft https://t.co/Yze9esXQUU
765387228960858113;2016-08-16 03:18:30;Demon Hunter Chicken anyone? #DemonHunter #Warcraft #Legion @Warcraft https://t.co/VscFTQRvSU via @Forge
765386975855644672;2016-08-16 03:17:29;Demon Hunter Chicken anyone? #DemonHunter #Warcraft #Legion @Warcraft https://t.co/VscFTQzV1m
765382082902106112;2016-08-16 02:58:03;"Two new dungeons coming in #Legion. Code ""game9"" for cheap wow gold on https://t.co/c1SvZSQTGe. #wow #Warcraft https://t.co/9LJJz3oRTQ"
765381841377370112;2016-08-16 02:57:05;LFR in a nutshell...#Legion #LookingForRaidInAllTheWrongPlaces #worldofwarcraft #IloveThisCommunity #Warcraft https://t.co/mKPGqUBxJJ
765379238207684608;2016-08-16 02:46:45;Gotta love the view. #Warcraft #Legion https://t.co/GbD4enxFIl
765378105158594560;2016-08-16 02:42:14;Couple demon hunter transmogs #Legion #Warcraft #Blizzard https://t.co/q1S6VUXEBW
765377617708978176;2016-08-16 02:40:18;Time for a litlte fire action. #deeznerdz #mage #fire #warcraft #legion https://t.co/XqhOM4oXHV
765377150253957122;2016-08-16 02:38:27;https://t.co/cbCr4kdN0y It's time for a Demon Hunt! #Warcraft #Legion #WarriorPride https://t.co/8bYkRAe6Gq
765375429683343360;2016-08-16 02:31:37;#Blizzard fights chat abuse in World of #Warcraft #Legion #WoW #Gaming #MMO #RPG #Tech https://t.co/U6RlC2xfRD https://t.co/tpv3yeSRNL
765374464137789440;2016-08-16 02:27:46;"""Who among you will help me avenge him?"" #Warcraft #Legion https://t.co/dQg6gpzrqf"
765372756754128896;2016-08-16 02:20:59;Finally rounded out the old stables before #Legion launches... #Warcraft https://t.co/xCJWXY7dDQ
765372544648114176;2016-08-16 02:20:09;Those three losses are hard to take in. But the arrival of the #Legion is only the beginning. Amazing cut-scenes. 😢 #Warcraft
765371040855953408;2016-08-16 02:14:10;The level scaling for #Legion Invasions is... weird. My lowbie alts are pulling demons off level 100s. Doesn't mater, but still. #warcraft
765369811937275906;2016-08-16 02:09:17;#demonhunter #legion #felfire #bloodelf #worldofwarcraft #wow #warcraft #blizzard #green https://t.co/NenNWMpPD2
765369481023463424;2016-08-16 02:07:58;Dear Varian, Sylvanas was about to get rekt and still wouldn't have been a help to you. Hugs and kisses, Allori #Warcraft #legion
765368728141692928;2016-08-16 02:04:59;does a dh need any other mount than this? #demonhunterhype #legion #warcraft https://t.co/DYJ0K53SI9
765367114685353988;2016-08-16 01:58:34;Being a Demon Hunter and pass on Warglaive of Azzinoth in World of #Warcraft #Legion ! ^^ https://t.co/rAxDOYlN7N
765365626592452608;2016-08-16 01:52:39;Nice pic form World of #Warcraft #Legion, with #Ilidan ! https://t.co/Vpc7wfhGU0
765364086058029056;2016-08-16 01:46:32;ZEPPELIN PARTY!! #warcraft #legion https://t.co/0nNnYeQ9MZ
765363453041213440;2016-08-16 01:44:01;Farming some invasion gear for the monk! #heals #warcraft #legion #mistweaver  https://t.co/ZHF5Sh0oWO
765359949404774402;2016-08-16 01:30:06;#Legion previews from @mmochampion #Warcraft https://t.co/8ncT01oiWk
765357663332945920;2016-08-16 01:21:01;Kimbertia is a #Dreadlord??? She works for the #Legion??World of #Warcraft! https://t.co/MxJb9mgM6C
765353875847151618;2016-08-16 01:05:58;Ich wurde schon vor Monaten gespoilert, aber Ich bin trotzdem schockiert! 😳 Was für ein grausames Ende für Varian... 😭 #warcraft #Legion
765353748499722240;2016-08-16 01:05:27;Gonna time some leveling runs on #Warcraft #Legion Beta tonight. Come place your bets!  https://t.co/m6Qk7cNkzd
765353352905515008;2016-08-16 01:03:53;Got a new headset today. #Legion #iampreparednow #Warcraft #Horde @SteelSeries #ftw https://t.co/1o5lmTHC6w
765351671375486980;2016-08-16 00:57:12;Feels good. #Warcraft #Legion https://t.co/YemZn4Ecn8
765348642291081217;2016-08-16 00:45:10;#leveln mit #event #legion #warcraft #test - nur event stehen, sonst NICHTS! - Start: Level70! https://t.co/CFEQie5yIc
765347471471972352;2016-08-16 00:40:31;You are not prepared! #warcraft #demonhunter #Legion https://t.co/a0tumVZpup
765347364441825281;2016-08-16 00:40:05;Protection Warrior artifacts will now be one-handed swords with exclusively frost traits. Bug? Feature? SMH. #warcraft #legion
765346621496303619;2016-08-16 00:37:08;Just two demon hunters out on the town. #Demonhunter #Legion #warcraft https://t.co/84gh3oTMYj
765345084372123650;2016-08-16 00:31:02;2 Boomkins, 1 Battleground: The battle for top killing blows. @Warcraft #Warcraft #Legion @DNR_CREW https://t.co/52hR6XRN5H
765343795642822656;2016-08-16 00:25:54;RT DNR_CREW: RT AmenaTM: Don't forget that I'm giving away one month of #Warcraft game time on Saturday! #Legion … https://t.co/Zwue1Hu2WJ
765343560275259392;2016-08-16 00:24:58;Preparing for Legion w @BuzzerkGaming like ... #TeamNoSleep  #Legion  #Warcraft  #expansion  #coffee  @DNR_CREW https://t.co/ndfh0oY0lP
765343092266401792;2016-08-16 00:23:07;Don't forget that I'm giving away one month of #Warcraft game time on Saturday! #Legion https://t.co/iixwDEIlEB @girlstreamers @DNR_CREW
765342437749297153;2016-08-16 00:20:31;In times of Chaos, he laughs o.O #Warcraft #Legion https://t.co/EqLa8ClooI
765340920875257856;2016-08-16 00:14:29;Just me and my demon and my badass sword. #legion #warcraft https://t.co/eFekDbjAtu
765340395756785664;2016-08-16 00:12:24;#leveln mit #event #legion #warcraft #test - nur event stehen, sonst NICHTS! - Start: Level70! https://t.co/rdEiJLyvvg
765339111049879556;2016-08-16 00:07:18;#warcraft #event #legion  :( https://t.co/5UnJDyycvF
765338693901152256;2016-08-16 00:05:38;#Blizzard ballgags chat abusers in World of #Warcraft #Legion #WoW #Gaming #MMO #RPG #Tech https://t.co/e8v0w4sSpQ https://t.co/KAVlfwFbHB
765338055892987904;2016-08-16 00:03:06;▇ Countdown 14 #Warcraft #Legion ▇ ▇ #PokemonGO #TeamValor ▇  ▇ You have two weeks with #Invasion and #Timewaking! ▇ https://t.co/gCf1qn4Dem
765337845238272001;2016-08-16 00:02:16;#leveln mit #event #legion #warcraft #test - nur event stehen, sonst NICHTS! - Start: Level5! https://t.co/KFhPewGExY
765337413346406400;2016-08-16 00:00:33;And so it continues ...  In two weeks it won't matter. Yet I cannot stop. Please halp. #warcraft #legion #invasions https://t.co/D5v3vKHR8B
765336939469869056;2016-08-15 23:58:40;#legion #legion #egion 😍😍😍😍😍😍😍😍😍😍😍😍😍😍 Hacía mucho tiempo que no cogía con tantas ganas el #Warcraft
765336332075839488;2016-08-15 23:56:15;"""Holy crap! It shot my dragon out of the sky!"" -Owl, on invasions #warcraft #legion"
765335400533590016;2016-08-15 23:52:33;#FelReaver kicked my ass. Having #BurningCrusade flashbacks. #Warcraft #WorldOfWarcraft #Legion #PreLaunchEvent
765334617318526976;2016-08-15 23:49:26;The #AquaWaterStrider doesn't actually stride on th water anymore?!  #Lame #Warcraft #Legion https://t.co/161NUUCXnu
765334127566589952;2016-08-15 23:47:29;Woohoo ! Just begun, already demoniac... World of #Warcraft #Legion ! https://t.co/rIZ6r8GMiP
765333940181856257;2016-08-15 23:46:45;Don't know if I want to main my Rogue or my Demon Hunter in #legion Halp. #Warcraft
765333815778807809;2016-08-15 23:46:15;#Legion #Warcraft #invasion https://t.co/GuJ5k5mTyW
765333320456470528;2016-08-15 23:44:17;Valtíel is Secretly a Sim #Legion #Warcraft https://t.co/7C6MjZgE8u
765333073135185920;2016-08-15 23:43:18;And so it begins ... #warcraft #legion #invasions https://t.co/codnMEC9t5
765329332256374786;2016-08-15 23:28:26;I shall call him Squeakers. And he shall be mine. And he shall be my Squeakers. #Warcraft #Legion https://t.co/xouGySJY1b
765328496373686272;2016-08-15 23:25:07;We're already growing up! We've started on some Vine content for all of our fine followers (yes, that's you). #Warcraft #Legion
765328450450108417;2016-08-15 23:24:56;My Demon Hunter looks weird tbh #Warcraft!#Legion #DemonHunter #WyrmrestAccord #NightElf #RP #Alliance #Havoc https://t.co/lW09zqtObZ
765326745964720128;2016-08-15 23:18:09;💜💚 #CorruptedFireHawk #Warcraft #Legion https://t.co/JWpfuhhXin
765325164452188160;2016-08-15 23:11:52;World of Warcraft Legion - The Broken Shore, Vol'jin and Varian (Lore Sp... https://t.co/J9QlQMonvT via @YouTube  #warcraft #legion
765323757246447621;2016-08-15 23:06:17;So just completed the Broken Isles scenario on Alliance side and words cannot describe how insanely awesome it was #Warcraft #Legion #hype
765322426343366657;2016-08-15 23:01:00;Helping a buddy get his first 100 WoW toon! @Warcraft #Warcraft #Legion https://t.co/i4jp1tlwbq
765322174949367808;2016-08-15 23:00:00;#Warcraft New Toy was added, its a limited time item will be removed when #Legion goes live!   https://t.co/ibGlJRducp
765321946791763971;2016-08-15 22:59:05;If the Alliance story arc in #Legion is to convince me to pay for a faction change of my Alliance toons, you win Blizzard. GG WP. #Warcraft
765321376802611200;2016-08-15 22:56:49;My Mage 😍💜 #Warcraft #Legion https://t.co/VpO9o2BLQB
765318011284709377;2016-08-15 22:43:27;Updating our look for Legion, and making the final adjustments to our raid schedule. Recruitment starts soon! #warcraft #fractal #legion
765316393931796480;2016-08-15 22:37:01;Look what I have found in #cologne - @Warcraft #LegionCafe - Sadly #doomhammer was not there yet #warcraft #Legion https://t.co/CEeCkH80n0
765316001017856001;2016-08-15 22:35:28;[3 000 quêtes achevées] ! #Warcraft #Legion https://t.co/8OSuIaN7zQ
765314052532961280;2016-08-15 22:27:43;#Legion #Warcraft https://t.co/25Czd7Dvlt
765313324615667712;2016-08-15 22:24:50;Still undecided on #Legion main - wishing I didn't play on my Monk though as it's complicated matters... #Warcraft
765310119076831232;2016-08-15 22:12:05;#Warcraft #Legion https://t.co/53OpoZ5CsD
765309936905621509;2016-08-15 22:11:22;Quick question: Who chose Altruis, and do you enjoy being wrong? #Demonhunterthings #Legion #Warcraft
765307004411846656;2016-08-15 21:59:43;#RIPVarianWrynn #Warcraft #Legion https://t.co/kCQTYcVJY6
765304917196177408;2016-08-15 21:51:25;That Anal For the Children is just.. cruel.. #WoW #Warcraft #WorldOfWarcraft #Legion https://t.co/D2GpQvhVh9
765303971502317568;2016-08-15 21:47:40;You can now earn experience when doing Legion Invasions as a low level! #Warcraft #Legion https://t.co/TqcgLO5gGP
765302874750513156;2016-08-15 21:43:18;How much Xp are lowbies getting from Invasion in full looms? #warcraft #legion
765302066646581252;2016-08-15 21:40:05;"Gave ""Dimension Ripper"" trait to Assassination Rogue artifacts. It's pretty much an I LOSE button. #warcraft #legion"
765301436913594368;2016-08-15 21:37:35;Two weeks til #Legion and the Ugly Jealous Influencer lives on. #Warcraft #Shipyard4Lyfe #UJI
765300653593952256;2016-08-15 21:34:29;Ho appena compiuto l'impresa [Difensore di Azeroth: Invasioni di Legion]! #Warcraft #wow #feastofstrength #legion https://t.co/qB23XTjxfO
765300500447264774;2016-08-15 21:33:52;Real talk: The name Uproarious makes for uproarious quest text. #warcraft #demonhunter #legion https://t.co/XFoHOnOaqe
765299250444066817;2016-08-15 21:28:54;to infinity and beyond! #Legion #Warcraft! https://t.co/vkY5hTfPU4
765294293359529986;2016-08-15 21:09:12;YAAAAS! Someone made this mod. Woohoo! Get 'Legion Invasion Timer'from Curse. #warcraft #Legion https://t.co/grjmVYtJGF
765292177660477442;2016-08-15 21:00:48;#Blizzard ballgags chat abusers in World of #Warcraft #Legion #WoW #Gaming #MMO #RPG #Tech https://t.co/e8v0w4sSpQ https://t.co/zN8Noc3Vpb
765289714450661376;2016-08-15 20:51:00;Like Illidana, Illidani, Chillidan, and ILLADAMNGIRL! #Illidan #Warcraft #Legion https://t.co/UEQZmzLFl7
765288099572219905;2016-08-15 20:44:35;#Warcraft #Legion https://t.co/RFTOQA38Id
765285673440014336;2016-08-15 20:34:57;Who says #druids can't look #creepy? #Warcraft #Legion https://t.co/KfxfDhZVif
765283008299405312;2016-08-15 20:24:22;Annnnnnd #Warcraft #Legion invasions just got even MORE awesome.  As if that was possible!  Warforged pieces can now drop from chests.
765282089897979905;2016-08-15 20:20:43;Yes! I always wanted Sylvanas as Warchief! Dark Lady watches over you. #Legion #Warcraft https://t.co/tl5M8Bq0Pl
765281521347493889;2016-08-15 20:18:27;New video up! Ridiculous XP and Fast Runs? [WOW LEGION INVASION TIPS] https://t.co/wcUN5FmOjE #warcraft #legion
765280803702079488;2016-08-15 20:15:36;Ok work day is done for now, need to take out some frustrations at kickboxing then later on some demon invasions in #Warcraft #Legion
765276605761527809;2016-08-15 19:58:55;Time to kick some legion booty! And yes, I wear a lot of black #Warcraft #WoW #Legion https://t.co/L8uaadPNqe
765273931016208384;2016-08-15 19:48:17;"Reactivating World of #Warcraft for #Legion. ""Yeah, let's play."" Oh, wait... addons. 🙈 https://t.co/lGlWJwjya9"
765273843388649472;2016-08-15 19:47:57;The Legion takes its toll. Tensions rise and allies die. #warcraft #wow #legion #burninglegion #blizzard  https://t.co/GAYpMRw0Rh
765272137980583937;2016-08-15 19:41:10;Check out my screenshot from World of #Warcraft!  Dwar-sized! #legion https://t.co/ABYVi1u3jt
765269616897687552;2016-08-15 19:31:09;Nothing says fun like doomsayers! #Legion #Warcraft https://t.co/p33ENEZ121
765269361481306112;2016-08-15 19:30:08;80 Days Until #BlizzCon! Who's ready? #Warcraft #Legion #Overwatch #HoTS #Hearthstone #Starcraft  https://t.co/I6Gbyx2DGO
765268397869240320;2016-08-15 19:26:18;*fel reaver noises* this cinematic will never get old.. #warcraft #legion @TerranGregory
765266882706468865;2016-08-15 19:20:17;Warning for my #swtor followers… My timeline will be a bit heavy on #Warcraft stuff b/c of the #Legion release. Consider yourself warned. 😏
765265999159582720;2016-08-15 19:16:46;"The #Legion ""login screen"" is amazing. 💖 #Warcraft"
765263995594956801;2016-08-15 19:08:49;Welp... Looks like I may end up getting more involved in the #Legion invasion than I thought. #Warcraft https://t.co/4JBXA0DXOv
765260559910576129;2016-08-15 18:55:09;You can get warforged gear from invasions? :O #Warcraft #WoW #invasion #Legion https://t.co/ZlkkOi5den
765259999283150848;2016-08-15 18:52:56;@KageSatsuki inspired by your scetch quickly produced this video https://t.co/XtxdT2WdrL #Legion #Warcraft #ForAzeorth
765257811047612416;2016-08-15 18:44:14;I found a #bellsprout today. #warcraft #legion https://t.co/qM172wJUDJ
765256979761668097;2016-08-15 18:40:56;#MotivationMonday Get all the invasion gear on all your toons. #warcraft #Legion https://t.co/KhMKnXxM8Z
765256768125558784;2016-08-15 18:40:05;New beast pet added in this build! Mighty Searcher is available in H/H breed only. Can't wait! #warcraft #legion
765255812486946816;2016-08-15 18:36:18;yoooo waaaahrscheinlich such ich noch ne Progress Gilde für #Legion #DH #DD #legionbeta #warcraft /w me
765255477097799680;2016-08-15 18:34:58;*We Are Live* Daily Demon Hunter Stuff Mog, PvP, and Invasion PvP  https://t.co/NLRw8erNIG #Warcraft #Legion https://t.co/qBygGxRkMJ
765255091498676224;2016-08-15 18:33:26;#DemonHunter #ForTheAlliance #RagnarosUS  #Warcraft #Legion https://t.co/gShlxo3x3g
765253519771308032;2016-08-15 18:27:11;Check out my screenshot from World of #Warcraft! THE BESSST #coffee #legion https://t.co/r5av7bivCH
765252480288587776;2016-08-15 18:23:03;Check out my screenshot from World of #Warcraft! Obligatory spaceship post. #legion #space https://t.co/rATbX7p4q9
765252448831344640;2016-08-15 18:22:56;[Spoilers] Historia dos Demon Hunters World of Warcraft Legion #wow #legion #warcraft https://t.co/IqXgbzdNOw
765250144262586368;2016-08-15 18:13:46;Are you absolutely sure? #warcraft #legion https://t.co/98XjtwZnvT
765249083196006400;2016-08-15 18:09:33;Check out my screenshot from World of #Warcraft! Chillin' out in #dalaran #legion https://t.co/xrHGe5MxSd
765248628789219328;2016-08-15 18:07:45;Looking for hard hitting ranged DPS and some healers to keep @Epic_Insanity alive. #Zuljin #Horde #Warcraft #Legion https://t.co/RtVkQ5298n
765245252076769280;2016-08-15 17:54:20;WoWkémon Go's Zubats #Legion #Warcraft https://t.co/AHWWzLRdxZ
765243474157432832;2016-08-15 17:47:16;Bueno, pues tarde productiva. Ya tengo main para rolear #Legion en el #Warcraft :D https://t.co/u8D50KVot7
765243116685254657;2016-08-15 17:45:51;#Legion #warcraft #RIPVarian #worldofwarcraftswag https://t.co/da3kQezAhJ
765242998162587648;2016-08-15 17:45:22;Which classes have been changed for the better/worse? Share your thoughts with us! #warcraft #legion
765237679185199105;2016-08-15 17:24:14;I will have all of my #DemonHunter profs maxed in time for #Legion. Finishing Archaeology tonight, and then will grind out Fishing #Warcraft
765237627381551109;2016-08-15 17:24:02;*spoilers* Everything is better with #Titanic music, even World of Warcraft. #Warcraft #Legion #wow https://t.co/JMdYItv7qN @TerranGregory
765232499995897857;2016-08-15 17:03:39;I loved my DH. but, i don't know the rotation. this's really sad! #Warcraft #Legion
765231374299115520;2016-08-15 16:59:11;What Games do you play while waiting for #Legion ? #warcraft #worldofwarcraft
765229469846175744;2016-08-15 16:51:37;Forse la #Blizzard vuol dirci qualcosa? #Warcraft #Legion https://t.co/Q15l4c3a4n
765225674957127680;2016-08-15 16:36:32;Leveling a warrior because Varian Wrynn. That is all. #Warcraft #Legion
