764543843035262976;2016-08-13 19:27:11;Hail to the chief baby! #warcraft #legion https://t.co/RAccktAWff
764543331946860544;2016-08-13 19:25:09;Das #Legion Event ist schon der Hammer :D  #Warcraft https://t.co/YGu0RWeYcu
764543265077166080;2016-08-13 19:24:53;Thanks Burning Legion, thanks for all the sweet, sweet experience. It's okay you're wrecking our world, just this once. #Warcraft #Legion
764542812625010688;2016-08-13 19:23:05;Doing some Mythic Dungeons on LIVE Demon Hunter DPS PoV  https://t.co/OmEB0HzBBl #Warcraft #Legion
764539711243202561;2016-08-13 19:10:46;"Streaming soon (TM)! https://t.co/uNiSBqkokL (2pm CST) DEMON HUNTER!! 😈 Not Hunter, just Demons ;) lol. #WOW #Warcraft #Legion!! 💕😈🤓😎"
764537524463214592;2016-08-13 19:02:04;Demon Invasion #Warcraft #Legion #Demon #Invasion #DunMorogh #Ironforge https://t.co/yol0CHMy2F
764533734947319808;2016-08-13 18:47:01;Can't wait for my CE! #warcraft #legion https://t.co/j9ef4XITqH
764533404784287744;2016-08-13 18:45:42;Anduin is stuck in the stairs! #Warcraft #Legion #Glitch #DemonInvasion https://t.co/CGMkG6r158
764532963073589248;2016-08-13 18:43:57;#Legion invasions: deciding to hit my hunter's pet when you were at 20% HP was probably not your smartest move of the day. #Warcraft
764531983175315456;2016-08-13 18:40:03;"Scraped a new skill from the latest build: ""Asteroid Armor"". No word on what spec tho. Need moar infos. #warcraft #legion"
764531347306209280;2016-08-13 18:37:32;Rings 9 and 10 done and my last heirloom trinket dropped. A very successful start to the weekend! #Warcraft #Legion https://t.co/IJRRlQyY6E
764526751628333056;2016-08-13 18:19:16;Vote for giveaways! https://t.co/yWs4qe8mTR #giveaway #worldofwarcraft #gametime #wowtoken #Legion #warcraft #Twitch https://t.co/Ki0o9RjcyE
764524444110852096;2016-08-13 18:10:06;Und was spielt ihr so? (•̀ᴗ•́)و ̑̑   #Warcraft #Legion https://t.co/7ltG2sCVSm
764523378497773568;2016-08-13 18:05:52;Aso, ich bin schon auf der Insel gewesen #Warcraft #Legion https://t.co/lAVxp3b9oy
764522536105148416;2016-08-13 18:02:31;Narrows down my legion main to either resto #shaman or MW #monk thoughts?  #WoW  #Warcraft  #Legion
764522213299015681;2016-08-13 18:01:14;/dance :v #Warcraft #Legion https://t.co/wezzf8Q06z
764521672929968128;2016-08-13 17:59:05;Il est beau mon Sòbek ! #WoW #Blizzard #Legion #Warcraft #DemonHunter https://t.co/OdfEqE4NOY
764520074849951744;2016-08-13 17:52:44;Jus gunna put dis 'ere. #Warcraft #Legion https://t.co/yNikXYrnOc
764518878110187520;2016-08-13 17:47:59;The Fell is The [Defender of Azeroth: Legion Invasions] Achievement! #Warcraft #legion https://t.co/S8ivKNlMVs
764518101429972992;2016-08-13 17:44:54;Farming mounts in #WoW #Warcraft #Worldofwarcraft #Legion  WATCH HERE: https://t.co/PC3akhxu5A https://t.co/ZB4GXwOy9x
764516700498845696;2016-08-13 17:39:20;"Eruel &lt;3 #Warcraft #Legion https://t.co/txVd5m2r7D"
764515484112818177;2016-08-13 17:34:30;FEEL MY WRATH!! #Warcraft #Screenshot #Selfie #Dreadlord #Legion https://t.co/aPNWHeKGxh
764515321873137665;2016-08-13 17:33:51;#Legion World of #Warcraft! https://t.co/OfaMg1fJpH
764513857238814720;2016-08-13 17:28:02;Tailors get your Clothes Chest Patterns before #Legion comes #GoldMaking #Warcraft https://t.co/BujWeizcoP https://t.co/J9UrQAjxUr
764513086959132672;2016-08-13 17:24:58;Just defending Org from random Demon Spawns XD #Legion #Warcraft! https://t.co/OBMLOu68Gc
764511559355928576;2016-08-13 17:18:54;Hot Damn Blizzard are getting dark with their transmog acquisition #warcraft #legion #worldofwarcraft  https://t.co/Uz56oWQ5PT
764509268586401792;2016-08-13 17:09:48;The Horde need our help on the Broken Shore! #Warcraft #Legion https://t.co/gSA4cIoCqs
764506802973179904;2016-08-13 17:00:00;#Legion Invasion added a new toy, here is how you get it #warcraft  https://t.co/ibGlJRducp
764506115300331520;2016-08-13 16:57:16;my ride or die bitch!!!  #Bexxeb  #WARCRAFT  #LEGION https://t.co/yBMIUu9LIv
764503433642516480;2016-08-13 16:46:37;Who needs a shoulder Transmog when you are tatted and Glorious #Warcraft! #Transmog #Demonhunter #Legion https://t.co/HK0bc4Atff
764503316608917504;2016-08-13 16:46:09;Doomhammer get's forged by Tony Swatton. Watermelon does not like that. #Legion #Warcraft https://t.co/y8T6L1OsyG https://t.co/X9s10uARiP
764502509486497792;2016-08-13 16:42:56;It has begun... #Warcraft #WoW #Legion #WoD #Selfie #PC #Gaming #Gamer #Blizzard #BlizzCon #potd… https://t.co/5luYqRjmsU
764499289024319488;2016-08-13 16:30:08;Come have fun with the largest, most active guild on #Sargeras! #Warcraft #Legion #JoinUs https://t.co/Evr68omPzF https://t.co/EMO0RANBWD
764496527284994048;2016-08-13 16:19:10;Here we go ! #DemonHunter #Legion Regardez ma capture d’écran de World of #Warcraft ! https://t.co/QEvwpt1OuQ
764494237408727041;2016-08-13 16:10:04;we'll get through this together! World of #Warcraft #LEGION INVASION Sparkle #peeps! /smile https://t.co/pAE3bFooSu
764492121646723072;2016-08-13 16:01:40;#Legion Nadchodzi! Stań do walki już dziś! https://t.co/RbUqE9VY3v #WoW #Warcraft #preorder #instant https://t.co/M2Bld58jwh
764491906223050752;2016-08-13 16:00:48;#Blizzard ballgags chat abusers in World of #Warcraft #Legion #WoW #Gaming #MMO #RPG #Tech https://t.co/e8v0w4sSpQ https://t.co/r7jrNAUkdV
764491598738526208;2016-08-13 15:59:35;So many elves o.o #Warcraft #Legion https://t.co/zdfxR88opE
764489775411630081;2016-08-13 15:52:20;my DH mogs complete with a touch of fel #warcraft #legion https://t.co/D1yXmssLZp
764489522948272129;2016-08-13 15:51:20;My Holy Priest is such a overpowerd badass.. they needed to list her two times xD #Warcraft #Legion #Laneida2874 https://t.co/gegqiheWh4
764488931958067201;2016-08-13 15:48:59;I will miss #Warlords' Garrison in #Legion, but not for the reasons #Warcraft might think... https://t.co/Wb6fkzffmQ https://t.co/BfcaxjzwSY
764488391585046529;2016-08-13 15:46:50;#Blizzard fights chat abuse in World of #Warcraft #Legion #WoW #Gaming #MMO #RPG #Tech https://t.co/U6RlC2xfRD https://t.co/16MNVfzaL7
764486683966537729;2016-08-13 15:40:03;Vengeance Demon Hunter artifacts will now be polearms with exclusively holy traits. WTH is going on? #warcraft #legion
764486222626623489;2016-08-13 15:38:13;Un dernier p'tit #selfie avec #Voljin #Warcraft #WoW #Legion https://t.co/4iTl6oh7VQ
764486035745243138;2016-08-13 15:37:29;Uhoh, my main character has 666 #Nethershards! It's a sign... of something! #Legion #Warcraft
764483789028405248;2016-08-13 15:28:33;Zandalari Transmog Farm ... Love this farm at the moment :)  Enjoy! :D #Warcraft #Legion  https://t.co/mp2SDEVeKB
764481566881873920;2016-08-13 15:19:43;How are those Demon Hunters going our #Warcraft fans? Is the #Legion Horde taking it's toll on your fav locations? https://t.co/HSsXfaIEG7
764479481180524544;2016-08-13 15:11:26;I DIDN'T SIGN UP FOR THIS INVASION! #Warcraft #Legion https://t.co/JUZCQz2n6D
764474130011918338;2016-08-13 14:50:10;"Gliding trough the air, what an amazing feeling &lt;3 #Warcraft #Demonhunter #Legion https://t.co/8qyONLOMO6"
764471012373237760;2016-08-13 14:37:47;My, you're a tall one!! #Warcraft #Legion https://t.co/uNOh8qRjJT
764470347181719552;2016-08-13 14:35:08;#DemonHunter #Legion #Warcraft #WorldOfWarcraft #Illidari #Nightelf #Mardum #Illidan https://t.co/3pKRryH2OO
764470158043648005;2016-08-13 14:34:23;#BUNTERtheHUNTER is skyrocketing his item level! #BlazingWings He'll be prepared for #LEGION #Rs #WARCRAFT #Selfie https://t.co/aMof2BncQm
764469667641581568;2016-08-13 14:32:26;[#warcraft] Your Artifact weapon will sense nearby demons in Dalaran #Legion. https://t.co/NmlI94kYhd
764469054832799744;2016-08-13 14:30:00;TheFell is hopelessly addicted to the #Prisma app. #warcraft #Legion https://t.co/qJct2ao3q2
764468351691350017;2016-08-13 14:27:12;When the @BlackSabbath album #HeavenAndHell syncs up so well with the Battle for the Broken Shore in @Warcraft. #Warcraft #Legion
764467741436809216;2016-08-13 14:24:47;Ooooooh. I think we in trouble. #Gaming #WoW #Legion #Warcraft #WorldOfWarcraft #Demons #Guldan https://t.co/kuu4ecH4Pp
764465720457515009;2016-08-13 14:16:45;Check out my #screenshotS from World of #Warcraft #LEGION Invasion https://t.co/SG44tYikpu
764465127844372480;2016-08-13 14:14:24;Plays somewhat different to Alpha as well, I can't put my finger on it but something's changed. Not my cup of tea, sadly. #Warcraft #Legion
764463907582808066;2016-08-13 14:09:33;THANKS FOR THE HEADS UP! #Legion #Warcraft https://t.co/RbyMIeX4qQ
764461726272196608;2016-08-13 14:00:53;Check out my #screenshotS from World of #Warcraft! #Legion Invasion #DANCE w/ #BUNTERtheHUNTER #BlaszingWings #CAKE! https://t.co/QdgtifTQMO
764460106604052480;2016-08-13 13:54:27;Just land alrady! Check out my screenshot from World of #Warcraft! #Legion #Invasion #WoW https://t.co/6qTeyicaJR
764460104439701504;2016-08-13 13:54:26;Since there will be no flying at the start of #Legion I'm going to be riding in STYLE!!! #Warcraft https://t.co/YJvaygkAyU
764459905654947840;2016-08-13 13:53:39;This looks so cool :O must feel great to hold Doomhammer in hands #Warcraft #Legion #ManAtArms https://t.co/D4gbhrIQ1V
764459745994481664;2016-08-13 13:53:01;J'espere Jaina va inciter Anduin a exterminer ces fils de pute de la #horde #Warcraft #Legion
764458693320544256;2016-08-13 13:48:50;Say hello to Gafz #Warcraft #Legion #DemonHunter #PrePatch #YouAreNotPrepared https://t.co/QmfDcJ2k0h
764457349218234368;2016-08-13 13:43:29;"J'adore le Chasseur de Demon &lt;3 #Legion #Warcraft @MPaastis https://t.co/LRgu58NPpk"
764455113989599232;2016-08-13 13:34:36;Check out this item I just got! [Felbat Pup] https://t.co/BbWIWmWokc #Warcraft #Legion pet #730
764454266492837888;2016-08-13 13:31:14;Until the very last! #Warcraft #Legion https://t.co/yF3yGAqhtm
764452061664583696;2016-08-13 13:22:28;#Legion #DemonHunting #Warcraft! https://t.co/jrw9veF7kX
764451238272466944;2016-08-13 13:19:12;Destruction can look pretty, but time to make haste to save the Crossroads #Legion #Warcraft! https://t.co/ZeAmm6hsLR
764446461941673984;2016-08-13 13:00:13;The Illidari will stop at nothing to obtain the Sargerite Keystone! #warcraft #legion #letsplay https://t.co/Ge3vk4haql
764443997033140224;2016-08-13 12:50:26;Pensé que era la única a la que le pasaba 😥 #Warcraft #Legion #WoW https://t.co/p7Y8qB4D1c
764442281428545536;2016-08-13 12:43:37;Check out my screenshot from World of #Warcraft! The portal to the new #Legion #Dalaran https://t.co/syVYaFDUR1
764441387840536576;2016-08-13 12:40:04;Removed Brewmaster Monks from the game because they're not needed for Legion end game. #warcraft #legion
764432956144353280;2016-08-13 12:06:33;ready set go ? #warcraft #legion #demonhunter https://t.co/kg3sV3aoP5
764424205253222400;2016-08-13 11:31:47;@KCA1120 @WarcraftDevs now that's alot of fun! i was doing this for about 3 hours. #Warcraft #Legion
764423319579860992;2016-08-13 11:28:16;https://t.co/TJWTDfkZAM Look i can fly at 1000% speed #DemonHunter #Warcraft #Legion
764419979928301568;2016-08-13 11:15:00;#Warcraft New Toy was added,  its a limited time item will be removed when #Legion goes live!  https://t.co/ibGlJRducp
764417789620879360;2016-08-13 11:06:17;Check out my screenshot from World of #Warcraft! #dance in #stormwind! #legion https://t.co/dLj93GA4BS
764417660373327872;2016-08-13 11:05:47;#Blizzard ballgags chat abusers in World of #Warcraft #Legion #WoW #Gaming #MMO #RPG #Tech https://t.co/e8v0w4sSpQ https://t.co/GBNz8klH8g
764416995244802048;2016-08-13 11:03:08;Ok donc le scénari #Legion se la joue #GOT oO #Warcraft #WorldOfWarcraft
764416651718688768;2016-08-13 11:01:46;#Blizzard fights chat abuse in World of #Warcraft #Legion #WoW #Gaming #MMO #RPG #Tech https://t.co/U6RlC2xfRD https://t.co/nZL6EcTzEJ
764415085372641281;2016-08-13 10:55:33;@Boogie2988 Are you planning to play #Legion ? It caught the attention of my inner nerd, coming back after a few years away from #Warcraft
764402995018788864;2016-08-13 10:07:30;Got into some accidental PVP during invasions. I know things are new but, I won both and felt competitive... #Warcraft #Legion
764400806493818880;2016-08-13 09:58:48;Чем больше шкаф, тем громче падает! #ЗаАзерот! #Legion World of #Warcraft https://t.co/8LeZddlaVT
764396939119067136;2016-08-13 09:43:26;Some legion education #Warcraft #legion #alliance https://t.co/S1PmWaLDny
764396089852190720;2016-08-13 09:40:04;"Data mined a new skill: ""Mirage Ballad"" for Mage. Moar info to follow. #warcraft #legion"
764392496000630784;2016-08-13 09:25:47;Heroes come in all shapes and size #gnome defenders and tech made quick work of a #Legion raiding party #warcraft https://t.co/FEHjc6iKER
764388478566199296;2016-08-13 09:09:49;That feel when gul'dan drains your soul but keeps on casting. #guldan #Legion #Warcraft https://t.co/kLVzHgXQYn
764385628230475777;2016-08-13 08:58:30;Apres mon DPS, mon TANK est lui aussi level 100. On va finir Draenor tranquillou avant de commencer le pré patch #Legion 🤘🏻 #WOW #Warcraft
764385103795683332;2016-08-13 08:56:24;"For the Horde &lt;3 #Legion #Warcraft! https://t.co/ftPjPpQOgU"
764380072061067264;2016-08-13 08:36:25;Y'know, when i think about it, in a way this is kind of all Thrall's fault. #Warcraft #Legion #worldofwarcraft
764363107032498176;2016-08-13 07:29:00;Death bird cometh. #warcraft #legion #druid #invasion https://t.co/rhQIb9BkMa
764358644481691648;2016-08-13 07:11:16;New Felbat Pup pet. ^_^ Love Blessing of Alune look. #Warcraft! #PetCollector #Druid #ForTheAlliance #Legion https://t.co/zU85Nj9kRB
764357686913822720;2016-08-13 07:07:28;"my daughter and my grandson &lt;3 #Legion #Warcraft! https://t.co/6klebPCqDe"
764356238033481728;2016-08-13 07:01:42;"""@OwlcapwnTV: Challenge accepted, kid. @Warcraft @DNR_CREW #Warcraft #Legion https://t.co/HEeBhA2rBc"" I will hack and defeat your"
764355813871845376;2016-08-13 07:00:01;New Toy added with the #Legion Invasion's #Warcraft its a limited item will be removed come end of the Invasions.  https://t.co/ibGlJRducp
764354746706694144;2016-08-13 06:55:47;#Blizzard ballgags chat abusers in World of #Warcraft #Legion #WoW #Gaming #MMO #RPG #Tech https://t.co/e8v0w4sSpQ https://t.co/OEKj3fZoGa
764353823070625792;2016-08-13 06:52:07;RT DNR_CREW: RT OwlcapwnTV: Challenge accepted, kid. Warcraft DNR_CREW #Warcraft #Legion https://t.co/fbaKnNpLMd https://t.co/Xh7uZsnOgs
764352896829911040;2016-08-13 06:48:26;Challenge accepted, kid. @Warcraft @DNR_CREW #Warcraft #Legion https://t.co/ky7GNVFOP3
764346155102789632;2016-08-13 06:21:38;https://t.co/Y1JYguSNi8 The Cenarion Heroes are recruiting. Argent Dawn EU #warcraft #legion. Social RP guild.
764337321537789952;2016-08-13 05:46:32;OMFG I've never cried before over #Warcraft. But damn!! That warchief scene.... #ForTheHorde #Legion
764337258627465216;2016-08-13 05:46:17;holy shit..... im a freaking legion spy?!?! what the hell happened lolz ?!! #legion #warcraft #fullmetaljacketguild https://t.co/7Q7v4kdS8a
764334661115924480;2016-08-13 05:35:58;You are born naked, the rest is [Fabulous]! #Warcraft #Legion #Transmog https://t.co/7xETL9kTcK
764332070113939456;2016-08-13 05:25:40;Weekending in Azeroth! #blizzard #Legion #warlock #warcraft https://t.co/QqvamwJYNI
764329440050458624;2016-08-13 05:15:13;I've been on hiatus for so long... do I really want to come back to this? Yes... yes I do. #Warcraft #Legion https://t.co/xKBEW1VEfn
764329108369207296;2016-08-13 05:13:54;Gotta say - I'm impressed with the Invasions tech and would like to hear the systems guys talk about how they did it. #Legion #warcraft
764328239770644480;2016-08-13 05:10:27;Demon Hunters finally rolled and ready. @RealTerrorwulf #Warcraft #Legion https://t.co/Rvz6gnhm3v
764324637555712001;2016-08-13 04:56:08;Good #morning #Warcraft #Legion https://t.co/sC5hTAKuaA
764324422333374464;2016-08-13 04:55:17;▇ Countdown 17 #Warcraft #Legion ▇ ▇ #PokemonGO #TeamValor ▇  ▇ ▇ #INVASIONS, AND the #ILLIDARI IS ON PLACE! ▇ ▇ https://t.co/rs0WfyPZ13
764322835493969921;2016-08-13 04:48:59;Under Invasion Repel the #Legion Forces Dun Morogh #WARCRAFT we've got this! lets kick ass! #RhinestoneSunglasses https://t.co/r6VBkQDTLO
764318311869931520;2016-08-13 04:31:00;New Mount 😁 #Warcraft #Legion #Mage https://t.co/lxvlMzMBxy
764317604605464576;2016-08-13 04:28:11;This is me helping everyone be well fed at moonfang. #warcraft #legion #moonfang https://t.co/AOEy0VexjY
764315610293661697;2016-08-13 04:20:16;My DH's current transmog :) #Warcraft #Legion #demonhunter https://t.co/mAmh5VzSj2
764315222022688768;2016-08-13 04:18:43;Round 2. Hopefully ram issue is fixed  https://t.co/NLRw8erNIG #Warcraft #Legion
764314067838312448;2016-08-13 04:14:08;Mattia Turzo - Shards of Alliance #Legion #Warcraft [Epic Fantasy Orchestral] https://t.co/lVKQxgGt3l vía @YouTube
764314024255389696;2016-08-13 04:13:58;On porte fièrement les couleurs ici . Pour la Horde ! #Warcraft #Legion #Horde https://t.co/A4KrloZCva
764311798866731009;2016-08-13 04:05:07;DEMONHUNTERPALOOZA Normal/Heroic Pugs [956/1096 Stream Challenge] #warcraft #legion https://t.co/soMFARlbHn
764310678375137280;2016-08-13 04:00:40;I'm running out of time to choose a main for #Legion. Holy Priest's have been tuned really well, but do I want s/t different? 😔😔 #Warcraft
764310204943101952;2016-08-13 03:58:47;#Blizzard ballgags chat abusers in World of #Warcraft #Legion #WoW #Gaming #MMO #RPG #Tech https://t.co/e8v0w4sSpQ https://t.co/NcXgrdnZLV
764308231178989568;2016-08-13 03:50:57;I'm hungry! I wish I knew where to get some food! #Warcraft! #Legion https://t.co/SInM6XlDoI
764307321241513984;2016-08-13 03:47:20;Right before the BWOOOOOM. Amazing #legion #Warcraft! https://t.co/gtsjaLXwUN
764304996011696128;2016-08-13 03:38:05;[Defender of Azeroth: Legion Invasions] Boom shakalaka! #Warcraft #Legion #SuckMyLeftOneDemonScum https://t.co/WoWBk0IRnG
764304651504287744;2016-08-13 03:36:43;LOLOL  that guy   #Stzadin has invasions to do yo  #WARCRAFT   #LEGION https://t.co/IZxJMHGYv7
764303572720758785;2016-08-13 03:32:26;Check me out, I'm tanking!  ROFL #Warcraft #Legion #BeastMasterTank https://t.co/uvFJh900sJ
764303505922334720;2016-08-13 03:32:10;Feels like the #Legion Horde/Alliance issue should be easily explained to each other. That said, the feels, man. #FortheAlliance #Warcraft
764298272265478144;2016-08-13 03:11:22;Little bit of sight seeing. Aerie Peak #Warcraft #legion https://t.co/eo08MjaGXz
764298195258208260;2016-08-13 03:11:04;I've never wanted someone to be corrupted by the #Legion so badly before. #warcraft https://t.co/GiePp4V3L8
764296335419813893;2016-08-13 03:03:40;Last, but not least, the nameless #crab.  #Warcraft #Legion https://t.co/Uvn9to2bWt
764296032578449408;2016-08-13 03:02:28;Adiós Bombastic, who took freakin' forever to track back in the #MoP days.  #Warcraft #Legion #Silkworm https://t.co/sBHhx40J2s
764295342166839296;2016-08-13 02:59:44;Been finding them all night on WRA to try and get @herrshaun a spreader w/o paying 11k. #Warcraft #Legion https://t.co/EJbpRwI2Bf
764295206380249089;2016-08-13 02:59:11;Goodbye #Fox that I don't even recall taming and never even named.  #Warcraft #Legion https://t.co/oZBq563gb8
764294595421233154;2016-08-13 02:56:46;Peace out, Sven.  You looked cool, but I never used you. #Warcraft #Legion #Axebeak https://t.co/l6qefOZVkq
764293807978323969;2016-08-13 02:53:38;Pre-expansion stable clean out.  Fare thee well. Snowflake.  #Warcraft #Legion #Chimera https://t.co/WrOJow2iib
764293782187544576;2016-08-13 02:53:32;"My baby Demon Hunter getting ready to kick some ass. &lt;3 #Warcraft #Legion https://t.co/eFJ0lhX16E"
764290950336217089;2016-08-13 02:42:17;The new 100 boost for alliance starts you off on an airship above the Broken Shore #Warcraft #Legion https://t.co/RvFaxSEIpc
764290599260450816;2016-08-13 02:40:53;gonna meet Onyxia!!!  #Bexxeb  #WARCRAFT  #LEGION https://t.co/AlKzWlopW3
764290514568871936;2016-08-13 02:40:33;I can't be the only one that tried to fly at it, am I? #warcraft #legion P.S. Owww lol https://t.co/XP5GpYWhWk
764290255377674240;2016-08-13 02:39:31;Not quite 100% on the mog yet, but here's my #DemonHunter #Legion #Warcraft https://t.co/HHgspit7MO
764290037420699648;2016-08-13 02:38:39;This was on Marduum.  So many pictures to take, so little time #Warcraft #Legion https://t.co/9Oxq0vkGxQ
764289772416217088;2016-08-13 02:37:36;Loving the sky effects with the invasions #Warcraft #Legion https://t.co/T97KokI12X
764288303118024704;2016-08-13 02:31:45;#Blizzard fights chat abuse in World of #Warcraft #Legion #WoW #Gaming #MMO #RPG #Tech https://t.co/U6RlC2xfRD https://t.co/OKmRNaeMH0
764285060073807872;2016-08-13 02:18:52;Welp, got my demon hunter to lvl 100. Back to #EQ2 for fun until the xpack comes out. #legion #warcraft #somanygamessolittletime
764281183932776449;2016-08-13 02:03:28;Really cool to see us all coming together and uniting against the #Legion! #Warcraft https://t.co/rxYQ0Ied47
764279434253836288;2016-08-13 01:56:31;Is there a glyph that lets me not turn orange? :-/ #warcraft #Legion https://t.co/Mzi5OvWPOw
764278174633041920;2016-08-13 01:51:31;Could have sworn there were about 30+ characters waiting for the Ship in Booty Bay tonight. The world is alive again! #Warcraft #Legion
764273552019234816;2016-08-13 01:33:08;closer shot of upper body #warcraft #Legion https://t.co/8369ayoupc
764273377238409221;2016-08-13 01:32:27;put together a more revealing tmog to show off the DH skin (used secret vendor horde boots tmog) #warcraft #Legion https://t.co/GmE71u7LP8
764273232488738816;2016-08-13 01:31:52;New Orobus art! Bwahahaha #spoopy #legion #warcraft #moonguard https://t.co/SKA1UmnFiQ
764273097260367872;2016-08-13 01:31:20;The invasions are a huge PvP party or what! #warcraft #legion
764270641088499712;2016-08-13 01:21:34;DEMONHUNTERPALOOZA Normal/Heroic Pugs [955/1096 Stream Challenge] #warcraft #legion #tears https://t.co/n4BRGRIHpb
764270326490419200;2016-08-13 01:20:19;#Legion bat is prepared! Ink only sketch I think I'll scan it later. #Warcraft https://t.co/GNT5R8NBJ9
764269065200435201;2016-08-13 01:15:19;[Spoilers] Os Acontecimentos do pré-lancamento do World of Warcraft Legion #wow #warcraft #legion https://t.co/Q40NUzM1fV
764264258494341120;2016-08-13 00:56:13;#jayfab #dj #producer #gamer #wow #warcraft #legion #invasion https://t.co/efzNB3pWQf
764262899174998016;2016-08-13 00:50:49;My first experience with #Legion invasions: stay in air while 100 horde kill everything otherwise they kill me.  So much fun 🙄 #Warcraft
764260221275541505;2016-08-13 00:40:10;Not scared of you!    #Warcraft  #Legion https://t.co/29gatuLqBI
764260187637252097;2016-08-13 00:40:02;Finished the #legion scenario from the #horde - interesting #plot in #warcraft - how will this turn out?
764259945944678400;2016-08-13 00:39:05;Tarren Mill #TRIPLE #Selfie #Legion Invasion World of #Warcraft enough of me 2 go around.. but can I drink the wine? https://t.co/8gCrmRPPnj
764259190558916608;2016-08-13 00:36:04;Swooping into an invasion!!! #legion #warcraft https://t.co/Yl094fjzYZ
764259125152931840;2016-08-13 00:35:49;Riding into the sunset #Warcraft #legion https://t.co/jzR7wtySGh
764257507888037892;2016-08-13 00:29:23;My main's new transmog using the plate invasion set #Legion #Warcraft https://t.co/wykXrfQwb9
764256501687001089;2016-08-13 00:25:23;Repel the #Legion Forces World of #Warcraft https://t.co/NpwH0octb5
764254153023651840;2016-08-13 00:16:03;@SophieNoe #Warcraft #Legion https://t.co/HaZbeGnuoF
764252026037346304;2016-08-13 00:07:36;Demon Invasion Squad goals. #Warcraft #Legion https://t.co/3S6vMtNjHN
764251900242001920;2016-08-13 00:07:06;2 nuevos cazadores de demonios al acecho! XD @SophieNoe #Warcraft #Legion! https://t.co/mnXvUSfcHW
764251566434025472;2016-08-13 00:05:47;#Blizzard ballgags chat abusers in World of #Warcraft #Legion #WoW #Gaming #MMO #RPG #Tech https://t.co/e8v0w4sSpQ https://t.co/hVZH5qMwjY
764251025326895105;2016-08-13 00:03:38;Today the master hurt Clive, not sure how he feels about this #legion #warcraft https://t.co/tEkPl3Fds0
764248363650912256;2016-08-12 23:53:03;tabuleiro de Heartstone em nova dalaran no World of #Warcraft! por enquanto acima de Karazan #legion https://t.co/b2ejghlX4W
764248289659260928;2016-08-12 23:52:45;Hmmm so it's bye bye Jillidane..Helloooooo Pokedemon. Not an Illidan reference in sight #Warcraft #Legion https://t.co/b3CsyhGknR
764248053154885633;2016-08-12 23:51:49;Four toons at iLvl 700 or above. Four more to go. #Legion #Warcraft #WoW
764246361759944704;2016-08-12 23:45:06;#FullServer #Warcraft #Legion https://t.co/BgeVtIeJzv
764245844984037376;2016-08-12 23:43:03;Hey @Blizzard_Ent @Warcraft, quick question...   #Legion #worldofwarcraft #warcraft #WoW https://t.co/kLDkncN7aT
764245655963463681;2016-08-12 23:42:18;Nadie sabe más de venganza que ella. ¡Por la Horda!. #Warcraft #Legión #Sylvanaswarchief #Spoiler https://t.co/ch1LjWWrgd
764244334183059457;2016-08-12 23:37:02;@GwendlynD Fel Kitty pet image from the #warcraft #legion collectors edition book. Squee? thanks @perculia :D https://t.co/gQ3ddun7Xj
764241635035144192;2016-08-12 23:26:19;Gonna work on the alliance #demonhunter now. :-) #warcraft #legion https://t.co/3kiNfexnAi
764241428243476480;2016-08-12 23:25:30;So yea, my Black Icy Bling doesn't shrink when I use a Whole body shrinka xD #warcraft #legion https://t.co/Y4t49591Kj
764239438184648708;2016-08-12 23:17:35;Make sure you TUNE IN @ 11PM EST - Demon Hunter Friday Stream! https://t.co/TK9WrSmXyJ #Warcraft #Legion #Friday https://t.co/GW4Q3NxP1E
764236874755874816;2016-08-12 23:07:24;Reminder: you can send your BoA glaives to alts and apply weapon upgrades, then send them back. :D Happy hunting! #warcraft #Legion
764235731392868352;2016-08-12 23:02:51;Still get those horde pricks who jump you when you're helping with invasions #warcraft #legion https://t.co/7icoIwYtfz
