763771334644072449;2016-08-11 16:17:31;Rawr. My Nelf male #DemonHunter #Legion #Warcraft https://t.co/pAb24aMDvu
763770995161325568;2016-08-11 16:16:10;Male Belf #DemonHunter Probably should give him the fabulous title... #Legion #Warcraft https://t.co/7Kx477geFJ
763767133243318272;2016-08-11 16:00:49;The #Legion #DemonHunter!   WoW Adventures #2 - LAYING SIEGE TO THE QUEEN! https://t.co/370UKL5Iss via @YouTube #Warcraft
763767124896649216;2016-08-11 16:00:47;#Blizzard ballgags chat abusers in World of #Warcraft #Legion #WoW #Gaming #MMO #RPG #Tech https://t.co/e8v0w4sSpQ https://t.co/QOZ4s509Sf
763767106890596352;2016-08-11 16:00:43;Vieltwinker brauchen sich keine Sorgen um die Pre-Event-Questreihe machen #Legion #Warcraft https://t.co/SN71FOPWKF https://t.co/epbv2X7zak
763767039076872192;2016-08-11 16:00:26;Made something for my #Alliance brothers in mourning after the #Legion patch.  #Warcraft #standtogether https://t.co/yXov8sy4mM
763766995124887552;2016-08-11 16:00:16;Découvrez les quêtes de pré-extension de World of #warcraft #legion sur notre chaine #gaming https://t.co/pZgmzeDGP4
763766668329885700;2016-08-11 15:58:58;i need to rename my mage jaina and then turn into a dreadlord #jainaisadreadlord #legion #warcraft https://t.co/wZXveg7L8g
763766615372468224;2016-08-11 15:58:45;Guess what Jaina? I'M IN YO CITY! #dalaran #warcraft #legion https://t.co/fo5PedfDzH
763764835003707393;2016-08-11 15:51:41;Wow... A Donation of ... has returned with the #Legion pre-launch event... that brings back some memories! #Warcraft https://t.co/gNcbuoqOBj
763764540513320961;2016-08-11 15:50:31;TWIC Recruiting! 6pm-9pm PT Wed/Thurs. #WoW #Warcraft #Legion #GuildRecruitment Apply NOW: https://t.co/q9ig1uGIU9 https://t.co/hWUbZPg3dR
763764384606875648;2016-08-11 15:49:54;"Einfach wundervoll so viele Spieler wieder in der offenen Welt auf einem Fleck zu sehen ;) #Warcraft #Legion https://t.co/4kApr7DuU6"
763763677170249732;2016-08-11 15:47:05;ermerger dermerns! #wowselfie #warcraft #legion #longlivevoljin https://t.co/ZvOMM7MrHO
763763595985453056;2016-08-11 15:46:45;#Blizzard fights chat abuse in World of #Warcraft #Legion #WoW #Gaming #MMO #RPG #Tech https://t.co/U6RlC2xfRD https://t.co/JfdKpHt3gA
763761910009528321;2016-08-11 15:40:04;"Gave ""Meat Shield"" trait to Discipline Priest artifacts. It's pretty much an I LOSE button. #warcraft #legion"
763761516822818817;2016-08-11 15:38:30;This fine-ass-army is here for your aid! #Legion #Warcraft #Booty https://t.co/G14E3qmjfo
763761145291411457;2016-08-11 15:37:01;My point is... #demonhunter #legion #Warcraft https://t.co/SdwfmM9s0x
763758232967974912;2016-08-11 15:25:27;Petite vente pour la découverte des démons. @Lessyagold #Warcraft #Legion https://t.co/tm7ushzuQ5
763757375861956609;2016-08-11 15:22:02;¡FOR THE HORDE!!!  [Lucha contra la Legión]! #Warcraft #Legion https://t.co/UvO0jnkWPh
763757050665046016;2016-08-11 15:20:45;Oh! I saved @sonofdraka @Thrall_RP_ @TheRealThrall from death. My one important moment in the next 2 years. Whee. #Legion #Warcraft #Baine
763753824972603393;2016-08-11 15:07:56;¡Acabo de conseguir el logro [Lucha contra la Legión]! #Warcraft #Legion https://t.co/hOL7xI6tP2
763750054532448256;2016-08-11 14:52:57;So Alaina ... killed herself? Wow, Blizzard, that's dark! #Warcraft #Legion https://t.co/imw6xYImMJ
763749957501345792;2016-08-11 14:52:34;New draw distance sure is nice, Elwynn Forest finally looks like one too! #Warcraft #Legion https://t.co/bkwNr0gCtH
763749574741749761;2016-08-11 14:51:03;@Warcraft_FR on est + que prêt ! on s'échauffe avec l'invasion #Legion vont en prendre plein la gueule ! #Warcraft https://t.co/9khZGf5zMF
763748187358294016;2016-08-11 14:45:32;my hunter is prepared for the legion #wowselfie #legion #forthehorde #fuelforthefel #Warcraft! https://t.co/ZNcNHB5a6f
763748059146747904;2016-08-11 14:45:01;I'm enjoying this Legion invasion! Crossroads is insane with people! #warcraft #legion #WoWLegion https://t.co/NV8Bsh2vSD
763746151334043648;2016-08-11 14:37:26;Während der Invastion im nördlichen Brachland kann man zeitweise den weißen Löwen als Pet haben #Warcraft #Legion https://t.co/f7XG4E6K9W
763745952721088512;2016-08-11 14:36:39;Tfw you almost lose the fight against the fel energy inside you #Legion #Warcraft https://t.co/XzcLm0eUtg
763744314627334144;2016-08-11 14:30:08;My #Reaction to the Broken Shore Cinematic! #Legion #Warcraft #Wow https://t.co/ZDCzQTA0Dn
763742280540794880;2016-08-11 14:22:03;Finally made my demon hunter :3 #Warcraft #Legion Her name is a very butchered Dune reference: Asayadena https://t.co/l2scMWFZJC
763738537439223808;2016-08-11 14:07:11;С батькой #Legion #Warcraft #Demonhunter https://t.co/EIjMyFm039
763738345742671872;2016-08-11 14:06:25;And my warlock's new transmog using the cloth Invasion set #Legion #Warcraft https://t.co/bbN1HYOHK4
763738125340438528;2016-08-11 14:05:33;My shaman's new transmog using the mail Invasion set #Legion #Warcraft https://t.co/NFYGKjZZqL
763737814332760065;2016-08-11 14:04:19;My DH's transmog using the leather Invasion set #Legion #Warcraft https://t.co/ycFQPBcSoQ
763736982623248384;2016-08-11 14:01:00;Spielzeugsammler aufgepasst! :) #Warcraft #Legion   https://t.co/1oK3cpSVTg
763732969748099072;2016-08-11 13:45:04;Well...I've successfully exhausted the invasions. #Legion #Warcraft
763731616942419970;2016-08-11 13:39:41;So Nef has a class call for DH...nice😂Did he also had one for DKs and Monks? #warcraft #Legion
763730794485575681;2016-08-11 13:36:25;Con el señor @ManuKero27 derrotando a las invasiónes de la #Legion #Warcraft! https://t.co/bpbNV0DPrE
763730212282568704;2016-08-11 13:34:06;According to my 2 year old, Gul'dan is as bad as 3 cows! I didn't realise cows were so evil 😆 #Warcraft #Legion
763729462672367616;2016-08-11 13:31:07;The latest cinematics make me more curious to the next expansion! @Warcraft #Legion #WorldofWarcraft #Warcraft #WoW https://t.co/gZhbIXUV6k
763728931640008704;2016-08-11 13:29:01;Demon Hunter Parachuting #Warcraft #Legion https://t.co/gXCgOlgLPx
763726909490462720;2016-08-11 13:20:59;When your mount journal and transmog tab are one #legion #warcraft #worldofwarcraft https://t.co/2IWVVMCCGG
763726476227309568;2016-08-11 13:19:15;Кто-нибудь, дайте Андуину кофе, похоже, он пьян #Warcraft #Legion https://t.co/4QJrxI4ewP
763726294261563392;2016-08-11 13:18:32;Forming the Demon Hunter only HFC raid! #Warcraft #Legion https://t.co/FHEy72WHbz
763724851404234752;2016-08-11 13:12:48;Are you a demon yet? #wow #legion #warcraft https://t.co/CrBJb2Ih0r
763721715155365889;2016-08-11 13:00:20;We begin our campaign against the Burning Legion in the Shattered Abyss of Mardum! #legion #warcraft #letsplay https://t.co/cwkkTsSB8M
763719023053930497;2016-08-11 12:49:38;DH day 2! Got his full invasion gear set yesterday, Just need to buy weapon upgrades now #Legion #Warcraft
763718887217258496;2016-08-11 12:49:06;I remember when the barrens was just the barrens and not a legion invasion sight! #Barrens #Warcraft #Legion https://t.co/CmcYrtwmyg
763718408034717696;2016-08-11 12:47:12;Victory for Sylvanas!💚 #Warcraft #Legion #ForTheHorde
763717012589842432;2016-08-11 12:41:39;Come hang out as I play through some invasions and check out the changes in #warcraft #Legion  https://t.co/vjF7kZSGJM
763716728702443520;2016-08-11 12:40:31;With all these horde ganking invasion sites I think we need the obligatory #NetflixAndInvade #Warcraft #Legion #ForAzeroth
763716612461621249;2016-08-11 12:40:04;Battle Pet collectors get some love! New humanoid pet! Wicked Grotesque drops in H/H breed only. #warcraft #legion
763716288136880128;2016-08-11 12:38:46;And I do mean messy.   #Warcraft #Legion https://t.co/IDYNR4uEkI
763715370196672512;2016-08-11 12:35:08;This invasion ended up being a little bit..messy.  #Warcraft #Legion https://t.co/q7TVJXXSzK
763712144282120192;2016-08-11 12:22:18;Blizzard has made some mistakes, but Demon Hunters is one of them. I am so happy I rolled one. #Warcraft #Legion
763711055826653184;2016-08-11 12:17:59;Vamos Jogar juntos no World of Warcraft Legion https://t.co/eydlXp71sk #wow #warcraft #legion
763710492120453121;2016-08-11 12:15:45;Lorna Crowley and Tess Greymane finally back on my screen and in my heart #blessed #Warcraft #Legion
763710454699061248;2016-08-11 12:15:36;"How did I forget that playing Alliance means being surrounded by whiny, little bitches &gt;_&lt; #Warcraft #Legion #ohfuckoff"
763710389364195329;2016-08-11 12:15:20;Warglaive of Azzinoth first try on my Demon Hunter :D #Warcraft #Legion #woot https://t.co/TJYgct1VBI
763709233401593856;2016-08-11 12:10:44;"esta es Radamante mi DH en #Legion #Warcraft ;) https://t.co/LiTrrO9E5m"
763708550258552833;2016-08-11 12:08:02;FIND HAPPINESS TODAY The Molsen Farm, Westfall #Rs #Selfie #Warcraft Repel the #Legion Forces #BLAZINGWINGS #LOVEit https://t.co/6axuP51cSf
763704423700951040;2016-08-11 11:51:38;I just earned the [Defender of Azeroth: Legion Invasions] Achievement! #Warcraft #legion FOR #AZEROTH! https://t.co/IjQuGg3yKw
763704184604536833;2016-08-11 11:50:41;Apple Metal rendering sometimes make wonderful views. Still, FPS difference is cool.   #WoW #WarCraft #Metal #Legion https://t.co/33TOSJVz9a
763703404485107712;2016-08-11 11:47:35;#Warcraft #Legion https://t.co/j2Wjs5tH0M
763703362919497728;2016-08-11 11:47:25;Gang Bang à la Croisée #legion de World of #Warcraft ! https://t.co/rChYwHmtOr
763703198670618624;2016-08-11 11:46:46;Please share ! https://t.co/6ROkYCqMWX #legion #voljin #Warcraft #worldofwarcraft
763702066745335808;2016-08-11 11:42:16;She big... #Legion #Warcraft https://t.co/E51MuYkkUk
763701833579827200;2016-08-11 11:41:20;Aquried the Fel Plate/Mail combo from the Legion Invasion event, All with unique weapon flavours!  What ya think?  #Warcraft #Legion
763701808866979840;2016-08-11 11:41:14;Faites face aux invasions de la Legion! [Défenseur d’Azeroth : invasions de la Légion] #Warcraft #lokamon #legion https://t.co/VqURw0zO8r
763700876234063872;2016-08-11 11:37:32;Love that damn scene! Life for Windrunner... or like Vol'Jin said Windrunna :)  #WoW #WarCraft #Legion #Windrunner https://t.co/mU27Vk86AG
763700033078321152;2016-08-11 11:34:11;#inlove #demonhunter #Warcraft #Legion @Warcraft_ES https://t.co/b7DF0kX1oS
763698861647036417;2016-08-11 11:29:32;Demon Hunters everywhere! :D Do You have one? #WOW #Warcraft #WorldofWarcraft #Legion #WowLegion #DemonHunter https://t.co/jHX4zOLwyn
763698247877685248;2016-08-11 11:27:05;From here, you can see the world tree and the stars! #warcraft #morning #legion https://t.co/mmUkJJuNFR
763692880175267841;2016-08-11 11:05:46;#Blizzard ballgags chat abusers in World of #Warcraft #Legion #WoW #Gaming #MMO #RPG #Tech https://t.co/e8v0w4sSpQ https://t.co/5r6vfobiPc
763691875081527296;2016-08-11 11:01:46;#Blizzard fights chat abuse in World of #Warcraft #Legion #WoW #Gaming #MMO #RPG #Tech https://t.co/U6RlC2xfRD https://t.co/n1JOiPoC7d
763688907414405120;2016-08-11 10:49:58;#ForTheAlliance #Warcraft #Legion https://t.co/ZBrVUz1LcN
763687302359085056;2016-08-11 10:43:36;Apologies for our recent silence, we are busy making some vital changes to the website. How are you enjoyed #Legion prepatch? #WoW #Warcraft
763678534925709312;2016-08-11 10:08:45;"Hotvu hrr hrr :&gt; FOR THE HORDE #warcraft #horde #demonhunter #forthehorde #legion #wow #bloodelf https://t.co/uPZMZa0q0d"
763677534789705728;2016-08-11 10:04:47;hot hot hot hot #warcraft #wow #demonhunter #hot #bloodelf #legion https://t.co/vFIH3GymIa
763676317925646336;2016-08-11 09:59:57;Enter to win a World of Warcraft: #Legion prize pack from @JINX! https://t.co/vaOkt7uJ8y #wow #warcraft
763676127881814016;2016-08-11 09:59:11;"""Not what one was expecting to see over Deadwind Pass."" #dalaran #warcraft #legion #awesome #gamergirl https://t.co/EnJpFiKpUR"
763674121716674560;2016-08-11 09:51:13;That feel when you want to main a DH in #Legion but your guild may not reform and finding a raid spot on one will be a nightmare. #Warcraft
763671313072422912;2016-08-11 09:40:04;Added an OP Feral spec for Priests. Lore definitely supports this change. Great job, devs! #warcraft #legion
763666996043055104;2016-08-11 09:22:54;Noch einmal haben wir unsere Übersicht zum #Legion Pre-Event aktualisiert: https://t.co/uMWVbZFLWP #Warcraft https://t.co/qEKcSdbRuW
763666915529285632;2016-08-11 09:22:35;"My #Warcraft #Legion invasion night: ""2 minutes until resurrection"""
763665697419436032;2016-08-11 09:17:45;"""Whose not prepared now Master?"" #demonhunters #warcraft #gamergirl #legion #illidan https://t.co/i2OYodreH2"
763665241326563328;2016-08-11 09:15:56;This view distance though!  #warcraft #demonhunter #Legion https://t.co/C5XwKLFEWW
763665151191052288;2016-08-11 09:15:34;HOORAY FOR ilvl 700 #LEGION Geardrop from an invasion! #wowhead #warcraft #nerdlife https://t.co/vqVjBy0dUp
763664053927571457;2016-08-11 09:11:13;How is everyone enjoying Demon Hunters? #Warcraft #Legion
763662227803082752;2016-08-11 09:03:57;the loa never lie #warcraft #legion #troll #wisdom #voljin
763660445723033600;2016-08-11 08:56:53;And again! Look at everyone in Westfall! #Legion #Warcraft! https://t.co/BGiKKOfful
763660071062671360;2016-08-11 08:55:23;Посмотрела пару роликов Легиона. С миссий на Расколотых берегах. Король мертв, да здравствует король. :(( #WorldOfWarcraft #WarCraft #Legion
763659426591023104;2016-08-11 08:52:50;Turn down WoW music -》 turn up Ballroom Blitz -》 go into Legion invasion as demon hunter -》 profit #Warcraft #Legion #DemonHunter
763659120914358272;2016-08-11 08:51:37;Today is a sad day for the Warcraft community. Two leaders lost. And the battle just beginning. #Warcraft #Legion #VarianWrynn #voljin
763658142081310720;2016-08-11 08:47:43;Loving #Legion invasions! Look at all these folks in old zones flying together! #Warcraft! https://t.co/gtADM9RKto
763656009483255808;2016-08-11 08:39:15;Actin during the #Legion invation! #Warcraft #wowselfie https://t.co/1RZSVdz7Ys
763652830506856454;2016-08-11 08:26:37;Wanted to go for more of a vampire feel with my Demon Hunter's look. #Warcraft #Legion https://t.co/GSacoVGUTK
763651498920128514;2016-08-11 08:21:19;I also had no idea new Dalaran is floating above Kara currently! #warcraft #legion https://t.co/RlL0r8u7iu
763643244215349248;2016-08-11 07:48:31;"""Tf I do wit dis?""   #warcraft #legion #dalaran https://t.co/qYzEjZ9YmL"
763640945497616384;2016-08-11 07:39:23;Demon Hunters, Broken Shore, and Invasions Begin for #Warcraft #Legion. Check on https://t.co/r1e3chNwcB https://t.co/9eBJX5c8Xm
763639010082234368;2016-08-11 07:31:42;Prison riot, #warcraft #legion style. https://t.co/4txT6QIzTk
763637611999162368;2016-08-11 07:26:09;#Warcraft #Legion #Spoilers  Did the prepatch event, wasn't too bad, might try to do the horde side too. https://t.co/ecE58QI3WA
763637559842963457;2016-08-11 07:25:56;Que mal se presenta el dia con la #Legion en World of #Warcraft! https://t.co/UDrbvZsEHr
763637214068764672;2016-08-11 07:24:34;#warcraft #Legion https://t.co/mi6S60Yyv1
763637128182071300;2016-08-11 07:24:13;#warcraft #Legion https://t.co/P8dzymA28e
763637030568005632;2016-08-11 07:23:50;#warcraft #Legion https://t.co/n8JA5t8Oj6
763636946115629056;2016-08-11 07:23:30;#warcraft #Legion https://t.co/Z7MfIzhQFu
763636880550207488;2016-08-11 07:23:14;Primer intento con mi Demon Hunter #Legion #Demon #Hunter #Onixya  #Warcraft https://t.co/DbLDfefHgV
763635629162921985;2016-08-11 07:18:16;Une petite vente de stuff trnasmogriphiable....  #Legion #Warcraft https://t.co/Vh9Ac3bhkz
763634612681793536;2016-08-11 07:14:13;Sign in #Legion found from the destruction of #Dalaran in #Warcraft #Worldofwarcraft #WoW https://t.co/8DbkVbHJRb https://t.co/0IssyT9Ntg
763633856729800704;2016-08-11 07:11:13;Thank you so much @TerranGregory. Broken shore cinematics are just perfect - my lore boner is ready for more! :D #Legion #WoW #Warcraft
763631665344344064;2016-08-11 07:02:31;@WarcraftDevs No off-hand items for casters from #Legion invasions? #worldofwarcraft #Warcraft
763629965090906112;2016-08-11 06:55:45;#Blizzard ballgags chat abusers in World of #Warcraft #Legion #WoW #Gaming #MMO #RPG #Tech https://t.co/e8v0w4sSpQ https://t.co/h9c2kck8Gy
763627819591143424;2016-08-11 06:47:14;When the whole squad is here. #Legion #Guldan #Tirion #Warcraft https://t.co/otbY8uvN97
763626014928998400;2016-08-11 06:40:04;"Added a buffed ""Justice through Sacrifice"" trait for Protection Paladin artifacts. Makes sense. #warcraft #legion"
763624610311053312;2016-08-11 06:34:29;Anyone else joining the @Warcraft pre-patch invasions to just afk and fix there UI #Warcraft #Legion
763622008856858625;2016-08-11 06:24:08;When u play your new #DemonHunter but it's a new class so tHERE ARE A MILLION PEOPLE IN THE STARTING ZONES. #Warcraft #ForTheHorde #Legion
763618036498575360;2016-08-11 06:08:21;We're coming for you, buddy! Again #Warcraft #Legion https://t.co/ruxkXxTWP1
763617910866661376;2016-08-11 06:07:51;Oh #Legion why must you play with my emotions like that. #Feral #Druid #Wow #Warcraft #cinematics
763614932856365060;2016-08-11 05:56:01;After this pre-event, i calm down overnight and still try to sort my lore thoughts about the upcomming plot #Warcraft #Legion
763614476960751616;2016-08-11 05:54:13;Real Talk: Helcular in Hillsbrad sounds badass during the Invasion. #Legion #Warcraft
763611399167811584;2016-08-11 05:41:59;"Our mini-adventure in #legion, we went to Hillsbrad &amp; Azshara. #warcraft #selfie #cutestcouple  @Kayleta_donavan https://t.co/L7544Rgw7J"
763611151095693312;2016-08-11 05:41:00;How to Make Gold with Flipping Frozen Orbs in World of #Warcraft #Legion #WoW #GoldMaking https://t.co/s9FWEOIRjq
763609314195943424;2016-08-11 05:33:42;There are a lot of ways to pass the time before the expansion #legion #Warcraft https://t.co/aKnAuWqFv8
763605949198192643;2016-08-11 05:20:20;Ya know..just hanging around with some friends. The zeppelin broke on us and now we are stuck #legion #warcraft https://t.co/Uh8IgqMPts
763605624479485952;2016-08-11 05:19:02;"Eruel &lt;3 #Warcraft #Legion https://t.co/l8HkbdErHo"
763604648041279488;2016-08-11 05:15:09;Owlcapwn vs. Demon Huntards. Thanks for the free kills. @Warcraft @DNR_CREW #Warcraft #Legion https://t.co/GxlJ9Sr1GR
763602240980549632;2016-08-11 05:05:35;Leather invasion set complete! Gotta get dem weps #Warcraft #Legion https://t.co/6ldRO8qOE1
763598326503649281;2016-08-11 04:50:02;Trying to get a full set of the Invasion armor.  It is not going well... #Legion #FeelsBadMan #Warcraft #RNGsucks https://t.co/bsrGvHnkF3
763597875104407552;2016-08-11 04:48:15;guess where we are.. World of #Warcraft #Rs #Selfie #LOVEit #WhisperingForest Tirisfal Glades #Murkidan #LEGION https://t.co/dnXaaVxX5K
763595793571811329;2016-08-11 04:39:58;Anyone know if the Invasions have a chance to drop ilvl 700 shields too? #Legion #Warcraft
763595711153836033;2016-08-11 04:39:39;Loving my Demon Hunter ❤️  #Warcraft #Legion #DemonHunter https://t.co/smk44rXkli
763595648205586432;2016-08-11 04:39:24;I'm stuck. Send help :/  #Legion #WoW #Warcraft https://t.co/VLAaMpYa3z
763595038756446208;2016-08-11 04:36:58;On top of Stonehearth in AV :D  #Legion #WoW #Warcraft https://t.co/Ec4iHIj78a
763594799773462529;2016-08-11 04:36:01;All the places you can go with a Demon Hunter :D  #Legion #WoW #Warcraft https://t.co/B4E7QgZMET
763594332913934336;2016-08-11 04:34:10;Eruel, my new baby #Warcraft #Legion https://t.co/zINYQrvnID
763593334061461504;2016-08-11 04:30:12;Check out my #screenshotS from World of #Warcraft #Rs #Selfie #LOVEit Repel the #LEGION Forces Hillsbrad Foothills https://t.co/5gZGjH3tN3
763592836717617152;2016-08-11 04:28:13;New Dalaran #Warcraft #Legion https://t.co/GyFA31jRhJ
763592566851993600;2016-08-11 04:27:09;My illidari #Warcraft #Legion https://t.co/3l4w8ZLqoG
763591280224006145;2016-08-11 04:22:02;Got a few new pieces of armor for my #DemonHunter. So far I'm loving this class. :) World of #Warcraft #Legion https://t.co/RTz2nZ3BDM
763588603947655168;2016-08-11 04:11:24;My wife's Demon Hunter on warcraft.  Look at the item level! #warcraft #legion #demonhunter https://t.co/FnFGC9o4kK
763587791066398720;2016-08-11 04:08:10;Top Demon Hunter names I've seen so far:  - Grillidan - Mattdemon  #Warcraft #Legion
763586303824801792;2016-08-11 04:02:16;1 more invasion til I get the achieve! Dun morogh. Hopefully I can catch it tmw. #Legion #Warcraft
763585423754928128;2016-08-11 03:58:46;#Blizzard ballgags chat abusers in World of #Warcraft #Legion #WoW #Gaming #MMO #RPG #Tech https://t.co/e8v0w4bh1g https://t.co/psibm4eq0M
763584970480820224;2016-08-11 03:56:58;Digging the #swag #Legion gear from invasions so far.   #worldofwarcraft #Warcraft https://t.co/fMSMwy7GDg
763584736560283648;2016-08-11 03:56:02;▇ Countdown 19 #Warcraft #Legion ▇ ▇ #PokemonGO #TeamValor ▇  ▇ ▇ #INVASIONS AND the #ILLIDARI IS ON LIVE! ▇ ▇ https://t.co/VWZNJxbaCq
763583804321718273;2016-08-11 03:52:20;Good #Morning  #Warcraft #Legion #Invasion #Orgrimmar https://t.co/yg9zKYMX5w
763583751679082496;2016-08-11 03:52:07;Being able to afk some of these #Legion invasions after getting ganked is really letting me get caught up on manga. #Warcraft
763583282130726912;2016-08-11 03:50:15;Were Tyrande/Malfurion present at the Broken Shore scenario? I'd do it to check but my heart cant take it! #Warcraft #ForTheAlliance #Legion
763582281910890496;2016-08-11 03:46:17;Algae? Or coming of the #Legion... #PrometheusGuild #Warcraft  photo source- https://t.co/Foro5RP4K0 https://t.co/nHMGbuM2yQ
763582194786893825;2016-08-11 03:45:56;There is no better feeling than a fresh #Warcraft expansion! Soooo ready for #Legion!
763582003740422146;2016-08-11 03:45:11;¡Tranquilos! Caia los salvará a todos! :3 #Warcraft #Legion #DemonHunter https://t.co/3G90nwdcd8
763581667294535680;2016-08-11 03:43:50;"RAINHA DA PORRA TODA CARALHOOOOOOOO ME MATA DE ORGULHO &lt;33333 #warcraft #legion"
763581551607250944;2016-08-11 03:43:23;SYLVANA DONA E PROPRIETÁRIA NA EMPRESA HORDA #warcraft #legion
763580716449947648;2016-08-11 03:40:04;"Gave ""Celestial Breath"" trait to Frost Death Knight artifacts. It's pretty much an I WIN button. #warcraft #legion"
763579976092450816;2016-08-11 03:37:07;illicringe #demonhunter #warcraft #legion https://t.co/dtilLtVDeK
763579767056691200;2016-08-11 03:36:17;Westfall Invasion broken O.o sh*tloads of players waiting for fix #worldofwarcraft #Warcraft #legion #DemonHunter https://t.co/DZOzJeKLSl
763579654795956224;2016-08-11 03:35:50;https://t.co/aJexkQcxlr Watch me bawl like a baby on the #brokenisles in the new #legion patch #Warcraft #TGNarmy #dammitblizz
763578729725464576;2016-08-11 03:32:10;Anduin, Sir, just so we're clear: I don't enjoy delivering these letters to you...  Sincerely, The Altoholic #thanksGenn #warcraft #legion
763578230255169536;2016-08-11 03:30:11;Demon Hunter guide, Invasion news, updates, and more @Wowhead #Warcraft #Legion https://t.co/bfDopPFMBu
763577619451351040;2016-08-11 03:27:45;They updated the #Armory. Looks like no more crazy poses too! #Legion #Warcraft #Wardrodegoals https://t.co/4FMeyEgER1
763576551765970944;2016-08-11 03:23:31;Step 1.   #Warcraft  #Legion https://t.co/4YVsoztJb2
763575056396001280;2016-08-11 03:17:34;Come on! I can't imagine this is a coincidence! I see you with Jace and keifaaah! #warcraft #legion #teenmom2 https://t.co/WnPbKfSFHB
763574540949655552;2016-08-11 03:15:31;Moar invasions @nick_nacks_89 #Legion #Warcraft #SupportSmallStreamers https://t.co/lVpWLpEQyP
763573797949575168;2016-08-11 03:12:34;Did the scenario. Super sad. #Warcraft #Legion
763573644853448704;2016-08-11 03:11:58;#Warcraft Tienes problemas al intentar hacer las INVASIONES de la #Legion ? Aquí la solución!! https://t.co/t3pM0h1yOM
763572772937293825;2016-08-11 03:08:30;Couldn't wish for a better start! #warcraft #legion #DemonHunter https://t.co/wQpICVX9uU
763570808216231936;2016-08-11 03:00:41;5/12 Invasion weapons, not bad for one night of farming. #Warcraft #Legion #PrePatch #Weapons #Tmog
763567830939742208;2016-08-11 02:48:51;Sounds like beach weather!  Or playing #Warcraft #legion invasions in an AC house! https://t.co/BaDke6Al9Z
763567140574203904;2016-08-11 02:46:07;The moment you realize you created a Horde Demon Hunter and you're Alliance #wowhead #nerdproblems #warcraft #legion https://t.co/mnC12VLDTj
763566209476403200;2016-08-11 02:42:25;I don't think I have ever seen so many people on the flight path at the same time. #Warcraft #Legion https://t.co/mY8bOxoHIK
763566125875470336;2016-08-11 02:42:05;Still need to prepare for #Legion? Come hang out with our alt raid, we're in group finder now! #Warcraft https://t.co/x1QH8vXL44
763565908740546560;2016-08-11 02:41:13;"HUMP DAY! #Legion invasions &amp; Timewalking dungeons, want to join? #Warcraft #CGN @TwitchShare @TwitchSharing  https://t.co/fxrUrPvmP0"
763564427220168704;2016-08-11 02:35:20;#lewd #lewrd #legion #warcraft.  I might be making a BE! https://t.co/k3xMkJ7I3J
763563822619602945;2016-08-11 02:32:56;Oh yeah, I'm streaming again. Trying to knock out half of Azsuna tonight for the #Warcraft #Legion leveling guide.  https://t.co/m6Qk7cvJaD
763563811542437889;2016-08-11 02:32:53;I can't stop jumping ^^ #Warcraft #Legion https://t.co/AiEs1Rl8Ti
763563527391019008;2016-08-11 02:31:45;#Blizzard fights chat abuse in World of #Warcraft #Legion #WoW #Gaming #MMO #RPG #Tech https://t.co/U6RlC2xfRD https://t.co/jPWCRFOVBw
763562479171633152;2016-08-11 02:27:35;Holy crap Blizzard! Broken Shore was amazing!! The feels!! #Warcraft #Legion
763560864003817472;2016-08-11 02:21:10;"&gt;Demon Hunters  #Warcraft #legion https://t.co/z2XD6qyH9O"
763559922348896256;2016-08-11 02:17:26;Invastion! O.o #deeznerdz #warcraft #legion https://t.co/8RQH2zDb4l
